mr,mr_new,pseudo_mr,text,da,entity,num_hops,num_triples
"recommend(name[Alexis Mac Allister], sport[association football], start time[2016])",Alexis Mac Allister sport association football. Alexis Mac Allister start time 2016. Alexis Mac Allister domain athletes.,Alexis Mac Allister Association Football 2016,Have you heard of Alexis Mac Allister? He started playing association football in 2016.,recommend,athletes,1,3
"recommend(name[Cristiano Ronaldo], sport[association football], sports teams[Al-Nassr])",Cristiano Ronaldo sport association football. Cristiano Ronaldo sports teams Al-Nassr. Cristiano Ronaldo domain athletes.,Cristiano Ronaldo Association Football Al-Nassr,Are you familiar with Cristiano Ronaldo? He's an association football player who has played for Al-Nassr.,recommend,athletes,1,3
"recommend(name[Yari Verschaeren], sport[association football], sports teams[R.S.C])","Yari Verschaeren sport association football. Yari Verschaeren sports teams R.S.C. Anderlecht, Belgium national under-21 football team. Yari Verschaeren domain athletes.","Yari Verschaeren Association Football R.S.C. Anderlecht, Belgium National Under-21 Football Team",Have you heard of Yari Verschaeren? He's an association football player who has played for both R.S.C. Anderlecht and the Belgium national under-21 football team.,recommend,athletes,1,3
"recommend(name[Novak Djokovic], sport[tennis], sports teams[N/A])",Novak Djokovic sport tennis. Novak Djokovic sports teams N/A. Novak Djokovic domain athletes.,Novak Djokovic Tennis N/A,Have you heard of Novak Djokovic? He's a professional tennis player.,recommend,athletes,1,3
"recommend(name[LeBron James], sport[basketball], num awards[17])",LeBron James sport basketball. LeBron James num awards 17. LeBron James domain athletes.,Lebron James Basketball 17,Have you heard of LeBron James? He's a basketball player with 17 awards.,recommend,athletes,1,3
"recommend(name[Hugo Dellien], sport[tennis], height[180])",Hugo Dellien sport tennis. Hugo Dellien height 180. Hugo Dellien domain athletes.,Hugo Dellien Tennis 180,Have you heard of Hugo Dellien? He's a professional tennis player with 180 cm height.,recommend,athletes,1,3
"recommend(name[Arike Ogunbowale], sport[basketball], awards[ACC Athlete of the Year])",Arike Ogunbowale sport basketball. Arike Ogunbowale awards ACC Athlete of the Year. Arike Ogunbowale domain athletes.,Arike Ogunbowale Basketball Acc Athlete Of The Year,Are you familiar with Arike Ogunbowale? She's a basketball player who was awarded the ACC Athlete of the Year.,recommend,athletes,1,3
"recommend(name[Besart Berisha], sport[association football], height[185])",Besart Berisha sport association football. Besart Berisha height 185. Besart Berisha domain athletes.,Besart Berisha Association Football 185,Have you heard of Besart Berisha? He's an association football player with a height of 185 cm.,recommend,athletes,1,3
"recommend(name[Kobe Bryant], sport[basketball], awards[Academy Award for Best Animated Short Film])",Kobe Bryant sport basketball. Kobe Bryant awards Academy Award for Best Animated Short Film. Kobe Bryant domain athletes.,Kobe Bryant Basketball Academy Award For Best Animated Short Film,Have you heard of Kobe Bryant? He's a basketball player who won the Academy Award for Best Animated Short Film.,recommend,athletes,1,3
"recommend(name[Noah Rubin], sport[tennis], awards[N/A])",Noah Rubin sport tennis. Noah Rubin awards N/A. Noah Rubin domain athletes.,Noah Rubin Tennis N/A,Have you heard of Noah Rubin? He's an accomplished tennis player.,recommend,athletes,1,3
"recommend(name[David Beckham], sport[association football], stats leader[2006 FIFA World Cup Match 19])",David Beckham sport association football. David Beckham stats leader 2006 FIFA World Cup Match 19. David Beckham domain athletes.,David Beckham Association Football 2006 Fifa World Cup Match 19,Have you heard of David Beckham? He was the stats leader in 2006 FIFA World Cup Match 19 for association football.,recommend,athletes,1,3
"recommend(name[Djamel Belmadi], sport[association football], start time[1996])",Djamel Belmadi sport association football. Djamel Belmadi start time 1996. Djamel Belmadi domain athletes.,Djamel Belmadi Association Football 1996,Have you heard of Djamel Belmadi? He's been an association football player since 1996.,recommend,athletes,1,3
"recommend(name[Ime Udoka], sport[basketball], team positions[small forward])",Ime Udoka sport basketball. Ime Udoka team positions small forward. Ime Udoka domain athletes.,Ime Udoka Basketball Small Forward,Have you heard of Ime Udoka? He's a small forward in basketball.,recommend,athletes,1,3
"recommend(name[Nilmar], sport[association football], sports teams[Al-Duhail SC, S.C])","Nilmar sport association football. Nilmar sports teams Al-Duhail SC, S.C. Corinthians Paulista. Nilmar domain athletes.","Nilmar Association Football Al-Duhail Sc, S.C. Corinthians Paulista",Have you heard of Nilmar? He plays professional association football for Al-Duhail SC and S.C. Corinthians Paulista.,recommend,athletes,1,3
"recommend(name[Kendall Gill], sport[basketball], team positions[small forward])",Kendall Gill sport basketball. Kendall Gill team positions small forward. Kendall Gill domain athletes.,Kendall Gill Basketball Small Forward," Are you familiar with Kendall Gill, the small forward in basketball?",recommend,athletes,1,3
"recommend(name[Anthony Joshua], sport[boxing], team positions[N/A])",Anthony Joshua sport boxing. Anthony Joshua team positions N/A. Anthony Joshua domain athletes.,Anthony Joshua Boxing N/A," Are you familiar with Anthony Joshua, the professional boxer?",recommend,athletes,1,3
"recommend(name[Paul Pogba], sport[association football], height[191])",Paul Pogba sport association football. Paul Pogba height 191. Paul Pogba domain athletes.,Paul Pogba Association Football 191,Have you heard of Paul Pogba? He's an association football player who stands 191 cm tall.,recommend,athletes,1,3
"recommend(name[LeBron James], sport[basketball], awards[Ohio Mr])",LeBron James sport basketball. LeBron James awards Ohio Mr. Basketball. LeBron James domain athletes.,Lebron James Basketball Ohio Mr. Basketball,Have you heard of LeBron James? He's a basketball player who won the Ohio Mr. Basketball award.,recommend,athletes,1,3
"recommend(name[Logan Paul], sport[boxing], num awards[3])",Logan Paul sport boxing. Logan Paul num awards 3. Logan Paul domain athletes.,Logan Paul Boxing 3,Have you heard of Logan Paul? He's a boxer with three awards.,recommend,athletes,1,3
"recommend(name[Ronaldo], sport[association football], awards[Italian Football Hall of Fame])",Ronaldo sport association football. Ronaldo awards Italian Football Hall of Fame. Ronaldo domain athletes.,Ronaldo Association Football Italian Football Hall Of Fame,Have you heard of Ronaldo? He's an award-winning association football player inducted into the Italian Football Hall of Fame.,recommend,athletes,1,3
"recommend(name[John Kirwan], sport[rugby union], height[191])",John Kirwan sport rugby union. John Kirwan height 191. John Kirwan domain athletes.,John Kirwan Rugby Union 191,Have you heard of John Kirwan? He's a rugby union player who stands at 191 cm.,recommend,athletes,1,3
"recommend(name[Lionel Messi], sport[association football], start time[2004])",Lionel Messi sport association football. Lionel Messi start time 2004. Lionel Messi domain athletes.,Lionel Messi Association Football 2004,Have you heard of Lionel Messi? He's been an association football player since 2004.,recommend,athletes,1,3
"recommend(name[Marta Xargay], sport[basketball], start time[1996])",Marta Xargay sport basketball. Marta Xargay start time 1996. Marta Xargay domain athletes.,Marta Xargay Basketball 1996,Have you heard of Marta Xargay? She's been playing basketball since 1996.,recommend,athletes,1,3
"recommend(name[Andy Murray], sport[tennis], awards[Laureus World Sports Award for Breakthrough of the Year])",Andy Murray sport tennis. Andy Murray awards Laureus World Sports Award for Breakthrough of the Year. Andy Murray domain athletes.,Andy Murray Tennis Laureus World Sports Award For Breakthrough Of The Year,Have you heard of Andy Murray? He's a tennis player who has won the Laureus World Sports Award for Breakthrough of the Year.,recommend,athletes,1,3
"recommend(name[Fredy Montero], sport[association football], height[176])",Fredy Montero sport association football. Fredy Montero height 176. Fredy Montero domain athletes.,Fredy Montero Association Football 176,Have you heard of Fredy Montero? He's a professional football player with 176 cm height.,recommend,athletes,1,3
"recommend(name[Besart Berisha], sport[association football], start time[2003])",Besart Berisha sport association football. Besart Berisha start time 2003. Besart Berisha domain athletes.,Besart Berisha Association Football 2003," Are you familiar with Besart Berisha, who has been in association football since 2003?",recommend,athletes,1,3
"recommend(name[Fredy Montero], sport[association football], team positions[forward])",Fredy Montero sport association football. Fredy Montero team positions forward. Fredy Montero domain athletes.,Fredy Montero Association Football Forward,Have you heard of Fredy Montero? He's a forward in association football.,recommend,athletes,1,3
"recommend(name[Larry Bird], sport[basketball], sports teams[Indiana Pacers, Indiana State Sycamores mens basketball])","Larry Bird sport basketball. Larry Bird sports teams Indiana Pacers, Indiana State Sycamores mens basketball. Larry Bird domain athletes.","Larry Bird Basketball Indiana Pacers, Indiana State Sycamores Mens Basketball",Have you heard of Larry Bird? He's a professional basketball player who has played for Indiana Pacers and Indiana State Sycamores mens basketball.,recommend,athletes,1,3
"recommend(name[Novak Djokovic], sport[tennis], awards[Order of St])",Novak Djokovic sport tennis. Novak Djokovic awards Order of St. Sava. Novak Djokovic domain athletes.,Novak Djokovic Tennis Order Of St. Sava,Have you heard of Novak Djokovic? He's an award-winning tennis player who was bestowed the Order of St. Sava.,recommend,athletes,1,3
"recommend(name[Giannis Antetokounmpo], sport[basketball], stats leader[2021 NBA All-Star Game])",Giannis Antetokounmpo sport basketball. Giannis Antetokounmpo stats leader 2021 NBA All-Star Game. Giannis Antetokounmpo domain athletes.,Giannis Antetokounmpo Basketball 2021 Nba All-Star Game,Have you heard of Giannis Antetokounmpo? He's a basketball player who led the 2021 NBA All-Star Game.,recommend,athletes,1,3
"recommend(name[Magic Johnson], sport[basketball], height[206])",Magic Johnson sport basketball. Magic Johnson height 206. Magic Johnson domain athletes.,Magic Johnson Basketball 206,Have you heard of Magic Johnson? He's a 206 cm tall basketball player.,recommend,athletes,1,3
"recommend(name[Davie Selke], sport[association football], start time[2013])",Davie Selke sport association football. Davie Selke start time 2013. Davie Selke domain athletes.,Davie Selke Association Football 2013,Have you heard of Davie Selke? He's an association football player who started playing in 2013.,recommend,athletes,1,3
"recommend(name[Jude Bellingham], sport[association football], stats leader[N/A])",Jude Bellingham sport association football. Jude Bellingham stats leader N/A. Jude Bellingham domain athletes.,Jude Bellingham Association Football N/A," Are you familiar with Jude Bellingham, the association football player who is a stats leader?",recommend,athletes,1,3
"recommend(name[Conor Washington], sport[association football], team positions[forward])",Conor Washington sport association football. Conor Washington team positions forward. Conor Washington domain athletes.,Conor Washington Association Football Forward,Have you heard of Conor Washington? He's a forward in association football.,recommend,athletes,1,3
"recommend(name[Yari Verschaeren], sport[association football], awards[N/A])",Yari Verschaeren sport association football. Yari Verschaeren awards N/A. Yari Verschaeren domain athletes.,Yari Verschaeren Association Football N/A,Have you heard of Yari Verschaeren? He's an association football player.,recommend,athletes,1,3
"recommend(name[Sam Morsy], sport[association football], awards[N/A])",Sam Morsy sport association football. Sam Morsy awards N/A. Sam Morsy domain athletes.,Sam Morsy Association Football N/A," Are you familiar with Sam Morsy, the association football player?",recommend,athletes,1,3
"recommend(name[Conor Washington], sport[association football], height[178])",Conor Washington sport association football. Conor Washington height 178. Conor Washington domain athletes.,Conor Washington Association Football 178,Have you heard of Conor Washington? He's a professional footballer with 178 cm height.,recommend,athletes,1,3
"recommend(name[Paul Pogba], sport[association football], place of birth[Lagny-sur-Marne])",Paul Pogba sport association football. Paul Pogba place of birth Lagny-sur-Marne. Paul Pogba domain athletes.,Paul Pogba Association Football Lagny-Sur-Marne,Have you heard of Paul Pogba? He's an association football player from Lagny-sur-Marne.,recommend,athletes,1,3
"recommend(name[Dwayne Johnson], sport[professional wrestling], team positions[defensive lineman])",Dwayne Johnson sport professional wrestling. Dwayne Johnson team positions defensive lineman. Dwayne Johnson domain athletes.,Dwayne Johnson Professional Wrestling Defensive Lineman,Have you heard of Dwayne Johnson? He's a professional wrestler and defensive lineman.,recommend,athletes,1,3
"recommend(name[Kiki VanDeWeghe], sport[basketball], height[203])",Kiki VanDeWeghe sport basketball. Kiki VanDeWeghe height 203. Kiki VanDeWeghe domain athletes.,Kiki Vandeweghe Basketball 203," Have you heard of Kiki VanDeWeghe, the basketball player that stands 203 cm?",recommend,athletes,1,3
"recommend(name[David Campese], sport[rugby union], team positions[winger])",David Campese sport rugby union. David Campese team positions winger. David Campese domain athletes.,David Campese Rugby Union Winger,Have you heard of David Campese? He was a winger in rugby union.,recommend,athletes,1,3
"recommend(name[Kiki VanDeWeghe], sport[basketball], start time[1980])",Kiki VanDeWeghe sport basketball. Kiki VanDeWeghe start time 1980. Kiki VanDeWeghe domain athletes.,Kiki Vandeweghe Basketball 1980,Are you familiar with Kiki VanDeWeghe? He began playing basketball in 1980.,recommend,athletes,1,3
"recommend(name[Ronaldo], sport[association football], team positions[forward])",Ronaldo sport association football. Ronaldo team positions forward. Ronaldo domain athletes.,Ronaldo Association Football Forward,Have you heard of Ronaldo? He's a forward in association football.,recommend,athletes,1,3
"recommend(name[Venus Williams], sport[tennis], height[185])",Venus Williams sport tennis. Venus Williams height 185. Venus Williams domain athletes.,Venus Williams Tennis 185,Have you heard of Venus Williams? She's a professional tennis player with a height of 185 cm.,recommend,athletes,1,3
"recommend(name[Besart Berisha], sport[association football], awards[N/A])",Besart Berisha sport association football. Besart Berisha awards N/A. Besart Berisha domain athletes.,Besart Berisha Association Football N/A,Have you heard of Besart Berisha? He's a professional association football player.,recommend,athletes,1,3
"recommend(name[Monty Brown], sport[American football], place of birth[Saginaw])",Monty Brown sport American football. Monty Brown place of birth Saginaw. Monty Brown domain athletes.,Monty Brown American Football Saginaw,Have you heard of Monty Brown? He's an American football player from Saginaw.,recommend,athletes,1,3
"recommend(name[Wilt Chamberlain], sport[basketball], stats leader[1962–63 NBA season])",Wilt Chamberlain sport basketball. Wilt Chamberlain stats leader 1962–63 NBA season. Wilt Chamberlain domain athletes.,Wilt Chamberlain Basketball 1962–63 Nba Season,Have you heard of Wilt Chamberlain? He was a basketball player and leader in the 1962–63 NBA season.,recommend,athletes,1,3
"recommend(name[Nick Kyrgios], sport[tennis], height[194])",Nick Kyrgios sport tennis. Nick Kyrgios height 194. Nick Kyrgios domain athletes.,Nick Kyrgios Tennis 194,Have you heard of Nick Kyrgios? He's a professional tennis player who stands at 194 cm.,recommend,athletes,1,3
"recommend(name[Ahmad Nourollahi], sport[association football], team positions[midfielder])",Ahmad Nourollahi sport association football. Ahmad Nourollahi team positions midfielder. Ahmad Nourollahi domain athletes.,Ahmad Nourollahi Association Football Midfielder,Are you familiar with Ahmad Nourollahi? He's a midfielder in association football.,recommend,athletes,1,3
"recommend(name[Noah Rubin], sport[tennis], sports teams[Wake Forest Demon Deacons mens tennis])",Noah Rubin sport tennis. Noah Rubin sports teams Wake Forest Demon Deacons mens tennis. Noah Rubin domain athletes.,Noah Rubin Tennis Wake Forest Demon Deacons Mens Tennis,Have you heard of Noah Rubin? He's a professional tennis player with Wake Forest Demon Deacons mens tennis.,recommend,athletes,1,3
"recommend(name[Maryna Zanevska], sport[tennis], team positions[N/A])",Maryna Zanevska sport tennis. Maryna Zanevska team positions N/A. Maryna Zanevska domain athletes.,Maryna Zanevska Tennis N/A,Have you heard of Maryna Zanevska? She's a professional tennis player.,recommend,athletes,1,3
"recommend(name[LeBron James], sport[basketball], awards[NBA All-Rookie Team])",LeBron James sport basketball. LeBron James awards NBA All-Rookie Team. LeBron James domain athletes.,Lebron James Basketball Nba All-Rookie Team,Have you heard of LeBron James? He's a basketball player who was on the NBA All-Rookie Team.,recommend,athletes,1,3
"recommend(name[Anthony Joshua], sport[boxing], height[198])",Anthony Joshua sport boxing. Anthony Joshua height 198. Anthony Joshua domain athletes.,Anthony Joshua Boxing 198," Are you familiar with Anthony Joshua, the boxer who stands 198 cm tall?",recommend,athletes,1,3
"recommend(name[Liam Neeson], sport[association football], stats leader[N/A])",Liam Neeson sport association football. Liam Neeson stats leader N/A. Liam Neeson domain athletes.,Liam Neeson Association Football N/A," Have you heard of Liam Neeson? He's an association football player, although he's not a stats leader.",recommend,athletes,1,3
"recommend(name[Wilt Chamberlain], sport[basketball], stats leader[1963–64 NBA season])",Wilt Chamberlain sport basketball. Wilt Chamberlain stats leader 1963–64 NBA season. Wilt Chamberlain domain athletes.,Wilt Chamberlain Basketball 1963–64 Nba Season,Have you heard of Wilt Chamberlain? He's a basketball player who led the stats for the 1963–64 NBA season.,recommend,athletes,1,3
"recommend(name[Carlos Alcaraz], sport[tennis], place of birth[El Palmar, Murcia])","Carlos Alcaraz sport tennis. Carlos Alcaraz place of birth El Palmar, Murcia. Carlos Alcaraz domain athletes.","Carlos Alcaraz Tennis El Palmar, Murcia"," Have you heard of Carlos Alcaraz? He's a tennis player from El Palmar, Murcia.",recommend,athletes,1,3
"recommend(name[Alexis Mac Allister], sport[association football], stats leader[Poland v Argentina])",Alexis Mac Allister sport association football. Alexis Mac Allister stats leader Poland v Argentina. Alexis Mac Allister domain athletes.,Alexis Mac Allister Association Football Poland V Argentina,Have you heard of Alexis Mac Allister? He's an association football player who's a leader in stats for Poland v Argentina.,recommend,athletes,1,3
"recommend(name[Venus Williams], sport[tennis], place of birth[Lynwood])",Venus Williams sport tennis. Venus Williams place of birth Lynwood. Venus Williams domain athletes.,Venus Williams Tennis Lynwood,Have you heard of Venus Williams? She's a tennis player from Lynwood.,recommend,athletes,1,3
"recommend(name[Hugo Dellien], sport[tennis], awards[N/A])",Hugo Dellien sport tennis. Hugo Dellien awards N/A. Hugo Dellien domain athletes.,Hugo Dellien Tennis N/A,Have you heard of Hugo Dellien? He's a professional tennis player.,recommend,athletes,1,3
"recommend(name[John Kirwan], sport[rugby union], team positions[winger])",John Kirwan sport rugby union. John Kirwan team positions winger. John Kirwan domain athletes.,John Kirwan Rugby Union Winger,Have you heard of John Kirwan? He's a winger in rugby union.,recommend,athletes,1,3
"recommend(name[Robert Lewandowski], sport[association football], height[185])",Robert Lewandowski sport association football. Robert Lewandowski height 185. Robert Lewandowski domain athletes.,Robert Lewandowski Association Football 185,Have you heard of Robert Lewandowski? He's an association football player who stands at 185 cm.,recommend,athletes,1,3
"recommend(name[Venus Williams], sport[tennis], start time[1994])",Venus Williams sport tennis. Venus Williams start time 1994. Venus Williams domain athletes.,Venus Williams Tennis 1994,Have you heard of Venus Williams? She started playing tennis in 1994.,recommend,athletes,1,3
"recommend(name[Ime Udoka], sport[basketball], place of birth[Portland])",Ime Udoka sport basketball. Ime Udoka place of birth Portland. Ime Udoka domain athletes.,Ime Udoka Basketball Portland,Have you heard of Ime Udoka? He's a basketball player from Portland.,recommend,athletes,1,3
"recommend(name[Noah Rubin], sport[tennis], num awards[0])",Noah Rubin sport tennis. Noah Rubin num awards 0. Noah Rubin domain athletes.,Noah Rubin Tennis 0," Have you heard of Noah Rubin, the tennis player who has won 0 awards?",recommend,athletes,1,3
"recommend(name[Kiki VanDeWeghe], sport[basketball], team positions[small forward])",Kiki VanDeWeghe sport basketball. Kiki VanDeWeghe team positions small forward. Kiki VanDeWeghe domain athletes.,Kiki Vandeweghe Basketball Small Forward,Have you heard of Kiki VanDeWeghe? He's a small forward in basketball.,recommend,athletes,1,3
"recommend(name[Kobe Bryant], sport[basketball], stats leader[2007 NBA All-Star Game])",Kobe Bryant sport basketball. Kobe Bryant stats leader 2007 NBA All-Star Game. Kobe Bryant domain athletes.,Kobe Bryant Basketball 2007 Nba All-Star Game,Are you familiar with Kobe Bryant? He was the stats leader in the 2007 NBA All-Star Game for basketball.,recommend,athletes,1,3
"recommend(name[Peter Lorimer], sport[association football], team positions[wing half])",Peter Lorimer sport association football. Peter Lorimer team positions wing half. Peter Lorimer domain athletes.,Peter Lorimer Association Football Wing Half,Are you familiar with Peter Lorimer? He was a wing half in association football.,recommend,athletes,1,3
"recommend(name[Liam Neeson], sport[association football], sports teams[Bohemian F.C.])",Liam Neeson sport association football. Liam Neeson sports teams Bohemian F.C.. Liam Neeson domain athletes.,Liam Neeson Association Football Bohemian F.C.,Have you heard of Liam Neeson? He's an association football player who played for Bohemian F.C.,recommend,athletes,1,3
"recommend(name[Dwayne Johnson], sport[professional wrestling], stats leader[N/A])",Dwayne Johnson sport professional wrestling. Dwayne Johnson stats leader N/A. Dwayne Johnson domain athletes.,Dwayne Johnson Professional Wrestling N/A," Have you heard of Dwayne Johnson, the professional wrestler who is a leader in his field?",recommend,athletes,1,3
"recommend(name[Robert Lewandowski], sport[association football], awards[Footballer of the Year])",Robert Lewandowski sport association football. Robert Lewandowski awards Footballer of the Year. Robert Lewandowski domain athletes.,Robert Lewandowski Association Football Footballer Of The Year,Have you heard of Robert Lewandowski? He's an association football player who was awarded Footballer of the Year.,recommend,athletes,1,3
"recommend(name[Neymar], sport[association football], sports teams[Paris Saint-Germain F.C.])",Neymar sport association football. Neymar sports teams Paris Saint-Germain F.C.. Neymar domain athletes.,Neymar Association Football Paris Saint-Germain F.C.," Are you familiar with Neymar, the professional association football player for Paris Saint-Germain F.C.?",recommend,athletes,1,3
"recommend(name[Ahmad Nourollahi], sport[association football], height[1.85])",Ahmad Nourollahi sport association football. Ahmad Nourollahi height 1.85. Ahmad Nourollahi domain athletes.,Ahmad Nourollahi Association Football 1.85,Have you heard of Ahmad Nourollahi? He's an association football player with a height of 1.85 m.,recommend,athletes,1,3
"recommend(name[Giannis Antetokounmpo], sport[basketball], height[211])",Giannis Antetokounmpo sport basketball. Giannis Antetokounmpo height 211. Giannis Antetokounmpo domain athletes.,Giannis Antetokounmpo Basketball 211,Have you heard of Giannis Antetokounmpo? He's a professional basketball player with 211 cm height.,recommend,athletes,1,3
"recommend(name[Anthony Joshua], sport[boxing], start time[2014])",Anthony Joshua sport boxing. Anthony Joshua start time 2014. Anthony Joshua domain athletes.,Anthony Joshua Boxing 2014,Are you familiar with Anthony Joshua? He's a professional boxer who started in 2014.,recommend,athletes,1,3
"recommend(name[Nilmar], sport[association football], sports teams[Al-Nasr SC, S.C])","Nilmar sport association football. Nilmar sports teams Al-Nasr SC, S.C. Internacional. Nilmar domain athletes.","Nilmar Association Football Al-Nasr Sc, S.C. Internacional",Have you heard of Nilmar? He's a professional association football player who has played for Al-Nasr SC and S.C. Internacional.,recommend,athletes,1,3
"recommend(name[Magic Johnson], sport[basketball], team positions[power forward])",Magic Johnson sport basketball. Magic Johnson team positions power forward. Magic Johnson domain athletes.,Magic Johnson Basketball Power Forward,Have you heard of Magic Johnson? He's a power forward in basketball.,recommend,athletes,1,3
