mr,mr_new,pseudo_mr,text,da,entity,num_hops,num_triples
"verify_attribute(name[David Beckham], rating[excellent], stats leader[2006 FIFA World Cup Match 19])",David Beckham rating excellent. David Beckham stats leader 2006 FIFA World Cup Match 19. David Beckham domain athletes.,David Beckham Excellent 2006 Fifa World Cup Match 19,You said that you love David Beckham for being a stats leader in the 2006 FIFA World Cup Match 19. Do you think all athletes with this kind of accomplishment are excellent?,verify_attribute,athletes,1,3
"verify_attribute(name[Besart Berisha], rating[okay], sport[association football])",Besart Berisha rating okay. Besart Berisha sport association football. Besart Berisha domain athletes.,Besart Berisha Okay Association Football,You said that Besart Berisha was okay. Is your opinion the same for all association football players?,verify_attribute,athletes,1,3
"verify_attribute(name[Djamel Belmadi], rating[okay], awards[N/A])",Djamel Belmadi rating okay. Djamel Belmadi awards N/A. Djamel Belmadi domain athletes.,Djamel Belmadi Okay N/A,You told me that Djamel Belmadi was only okay. Do you think this is the same for other athletes who haven't won any awards?,verify_attribute,athletes,1,3
"verify_attribute(name[Carlos Alcaraz], rating[okay], stats leader[N/A])",Carlos Alcaraz rating okay. Carlos Alcaraz stats leader N/A. Carlos Alcaraz domain athletes.,Carlos Alcaraz Okay N/A,You told me that Carlos Alcaraz is just okay. Do you think this is true for all athletes regardless of stats leader?,verify_attribute,athletes,1,3
"verify_attribute(name[Ronaldo], rating[good], sports teams[Real Madrid CF, FC Barcelona])","Ronaldo rating good. Ronaldo sports teams Real Madrid CF, FC Barcelona. Ronaldo domain athletes.","Ronaldo Good Real Madrid Cf, Fc Barcelona",You said that Ronaldo is good. Do you think that his level of play is similar across Real Madrid CF and FC Barcelona?,verify_attribute,athletes,1,3
"verify_attribute(name[John Kirwan], rating[okay], height[191])",John Kirwan rating okay. John Kirwan height 191. John Kirwan domain athletes.,John Kirwan Okay 191," You said John Kirwan was okay, but do you think that's the case for all athletes who are 191 cm tall?",verify_attribute,athletes,1,3
"verify_attribute(name[Billy Vunipola], rating[okay], height[188])",Billy Vunipola rating okay. Billy Vunipola height 188. Billy Vunipola domain athletes.,Billy Vunipola Okay 188,You said Billy Vunipola was okay. Do you think that's true for all athletes who are 188 cm tall?,verify_attribute,athletes,1,3
"verify_attribute(name[Ahmad Nourollahi], rating[okay], start time[2011])",Ahmad Nourollahi rating okay. Ahmad Nourollahi start time 2011. Ahmad Nourollahi domain athletes.,Ahmad Nourollahi Okay 2011,You said Ahmad Nourollahi was okay. Do you feel the same way about other athletes who started in 2011?,verify_attribute,athletes,1,3
"verify_attribute(name[Anthony Joshua], rating[okay], team positions[N/A])",Anthony Joshua rating okay. Anthony Joshua team positions N/A. Anthony Joshua domain athletes.,Anthony Joshua Okay N/A,You said that Anthony Joshua is just okay. Do you think that most athletes are only okay?,verify_attribute,athletes,1,3
"verify_attribute(name[Davie Selke], rating[okay], stats leader[2014 UEFA European Under-19 Football Championship])",Davie Selke rating okay. Davie Selke stats leader 2014 UEFA European Under-19 Football Championship. Davie Selke domain athletes.,Davie Selke Okay 2014 Uefa European Under-19 Football Championship,You said Davie Selke was 'okay'. Do you think he's an average athlete compared to other stats leaders from the 2014 UEFA European Under-19 Football Championship?,verify_attribute,athletes,1,3
"verify_attribute(name[Marta Xargay], rating[okay], team positions[point guard])",Marta Xargay rating okay. Marta Xargay team positions point guard. Marta Xargay domain athletes.,Marta Xargay Okay Point Guard,You said that Marta Xargay was okay as a point guard. Do you think that she is just okay for all positions?,verify_attribute,athletes,1,3
"verify_attribute(name[Kendall Gill], rating[okay], sport[basketball])",Kendall Gill rating okay. Kendall Gill sport basketball. Kendall Gill domain athletes.,Kendall Gill Okay Basketball,You said that Kendall Gill was okay. Do you think this is true for all basketball players?,verify_attribute,athletes,1,3
"verify_attribute(name[Kobe Bryant], rating[excellent], awards[BET Award for Athlete of the Century])",Kobe Bryant rating excellent. Kobe Bryant awards BET Award for Athlete of the Century. Kobe Bryant domain athletes.,Kobe Bryant Excellent Bet Award For Athlete Of The Century,You mentioned that Kobe Bryant was excellent and won the BET Award for Athlete of the Century. Do you think that he is one of the greatest athletes of all time?,verify_attribute,athletes,1,3
"verify_attribute(name[Neymar], rating[good], sport[association football])",Neymar rating good. Neymar sport association football. Neymar domain athletes.,Neymar Good Association Football,You seem to really appreciate Neymar's performance in association football. Is your appreciation for football players in general?,verify_attribute,athletes,1,3
"verify_attribute(name[David Beckham], rating[excellent], team positions[midfielder])",David Beckham rating excellent. David Beckham team positions midfielder. David Beckham domain athletes.,David Beckham Excellent Midfielder,You love David Beckham as a midfielder. Do you think all midfielders are excellent?,verify_attribute,athletes,1,3
"verify_attribute(name[Andy Murray], rating[good], num awards[5])",Andy Murray rating good. Andy Murray num awards 5. Andy Murray domain athletes.,Andy Murray Good 5," You said that you like Andy Murray, even though he has 5 awards. Do you think he is a great athlete in general?",verify_attribute,athletes,1,3
"verify_attribute(name[Besart Berisha], rating[okay], start time[2003])",Besart Berisha rating okay. Besart Berisha start time 2003. Besart Berisha domain athletes.,Besart Berisha Okay 2003,You said Besart Berisha was only okay when he started playing in 2003. Do you think that is true for all athletes from that time?,verify_attribute,athletes,1,3
"verify_attribute(name[Hugo Dellien], rating[okay], sports teams[Bolivia Davis Cup team])",Hugo Dellien rating okay. Hugo Dellien sports teams Bolivia Davis Cup team. Hugo Dellien domain athletes.,Hugo Dellien Okay Bolivia Davis Cup Team,You said that Hugo Dellien is okay when playing for the Bolivia Davis Cup team. Do you think that all players from that team are only okay?,verify_attribute,athletes,1,3
"verify_attribute(name[John Fleck], rating[okay], sport[association football])",John Fleck rating okay. John Fleck sport association football. John Fleck domain athletes.,John Fleck Okay Association Football,You said that John Fleck was okay. Is that how you would describe all association football players?,verify_attribute,athletes,1,3
"verify_attribute(name[Wilt Chamberlain], rating[good], team positions[center])",Wilt Chamberlain rating good. Wilt Chamberlain team positions center. Wilt Chamberlain domain athletes.,Wilt Chamberlain Good Center,You said that you liked Wilt Chamberlain as a center. Do you think he is a great player for any position?,verify_attribute,athletes,1,3
"verify_attribute(name[Venus Williams], rating[okay], num awards[3])",Venus Williams rating okay. Venus Williams num awards 3. Venus Williams domain athletes.,Venus Williams Okay 3,You mentioned that Venus Williams has been awarded 3 times. Do you think she is just okay compared to other athletes with the same number of awards?,verify_attribute,athletes,1,3
"verify_attribute(name[Andy Murray], rating[good], height[191])",Andy Murray rating good. Andy Murray height 191. Andy Murray domain athletes.,Andy Murray Good 191,You said that you liked Andy Murray's performance. Is that your opinion for all athletes who are 191 cm tall?,verify_attribute,athletes,1,3
"verify_attribute(name[Matt Holland], rating[okay], team positions[midfielder])",Matt Holland rating okay. Matt Holland team positions midfielder. Matt Holland domain athletes.,Matt Holland Okay Midfielder,You said Matt Holland was okay when he was a midfielder. Do you think that other midfielders are just okay too?,verify_attribute,athletes,1,3
"verify_attribute(name[Fredy Montero], rating[okay], sport[association football])",Fredy Montero rating okay. Fredy Montero sport association football. Fredy Montero domain athletes.,Fredy Montero Okay Association Football,You told me that Fredy Montero was okay. Is your opinion the same for all association football players?,verify_attribute,athletes,1,3
"verify_attribute(name[Fredy Montero], rating[okay], team positions[forward])",Fredy Montero rating okay. Fredy Montero team positions forward. Fredy Montero domain athletes.,Fredy Montero Okay Forward,You said that Fredy Montero was okay. Do you believe that forwards in general are just okay?,verify_attribute,athletes,1,3
"verify_attribute(name[Wayne Rooney], rating[good], start time[2002])",Wayne Rooney rating good. Wayne Rooney start time 2002. Wayne Rooney domain athletes.,Wayne Rooney Good 2002,You told me you like Wayne Rooney since he started playing in 2002. Do you have a positive opinion about other athletes from that era?,verify_attribute,athletes,1,3
"verify_attribute(name[David Campese], rating[good], awards[World Rugby Hall of Fame])",David Campese rating good. David Campese awards World Rugby Hall of Fame. David Campese domain athletes.,David Campese Good World Rugby Hall Of Fame,You seemed to appreciate David Campese's induction to the World Rugby Hall of Fame. Do you think he is one of the best rugby players of all time?,verify_attribute,athletes,1,3
"verify_attribute(name[Paul Pogba], rating[okay], awards[Knight of the Legion of Honour])",Paul Pogba rating okay. Paul Pogba awards Knight of the Legion of Honour. Paul Pogba domain athletes.,Paul Pogba Okay Knight Of The Legion Of Honour," You said that Paul Pogba was okay, despite being awarded the Knight of the Legion of Honour. Do you think that other athletes who have received this honour are also just okay?",verify_attribute,athletes,1,3
"verify_attribute(name[Ime Udoka], rating[okay], team positions[small forward])",Ime Udoka rating okay. Ime Udoka team positions small forward. Ime Udoka domain athletes.,Ime Udoka Okay Small Forward,You said that Ime Udoka is okay. Is that your opinion of all small forward players?,verify_attribute,athletes,1,3
"verify_attribute(name[Maryna Zanevska], rating[okay], sports teams[Belgium Billie Jean King Cup team])",Maryna Zanevska rating okay. Maryna Zanevska sports teams Belgium Billie Jean King Cup team. Maryna Zanevska domain athletes.,Maryna Zanevska Okay Belgium Billie Jean King Cup Team,You said Maryna Zanevska was okay. Do you believe that other players on the Belgium Billie Jean King Cup team are only okay?,verify_attribute,athletes,1,3
"verify_attribute(name[Lionel Messi], rating[excellent], awards[UEFA Club Footballer of the Year])",Lionel Messi rating excellent. Lionel Messi awards UEFA Club Footballer of the Year. Lionel Messi domain athletes.,Lionel Messi Excellent Uefa Club Footballer Of The Year,You love Lionel Messi for winning the UEFA Club Footballer of the Year. Is that how you would feel about other footballers who have achieved the same award?,verify_attribute,athletes,1,3
"verify_attribute(name[Wayne Rooney], rating[good], stats leader[England national association football team])",Wayne Rooney rating good. Wayne Rooney stats leader England national association football team. Wayne Rooney domain athletes.,Wayne Rooney Good England National Association Football Team,You said that you like Wayne Rooney for being a stats leader of the England national association football team. Do you think he is a great player in any position?,verify_attribute,athletes,1,3
"verify_attribute(name[Logan Paul], rating[okay], awards[Gold Play Button])",Logan Paul rating okay. Logan Paul awards Gold Play Button. Logan Paul domain athletes.,Logan Paul Okay Gold Play Button,You mentioned that Logan Paul was okay. Do you think that other athletes with a Gold Play Button are just okay?,verify_attribute,athletes,1,3
"verify_attribute(name[Novak Djokovic], rating[okay], sport[tennis])",Novak Djokovic rating okay. Novak Djokovic sport tennis. Novak Djokovic domain athletes.,Novak Djokovic Okay Tennis,You told me that Novak Djokovic was okay. Do you feel the same way about other tennis players?,verify_attribute,athletes,1,3
"verify_attribute(name[David Campese], rating[good], sport[rugby union])",David Campese rating good. David Campese sport rugby union. David Campese domain athletes.,David Campese Good Rugby Union,You said that you like David Campese in rugby union. Do you have a good opinion of all rugby union athletes?,verify_attribute,athletes,1,3
"verify_attribute(name[Lionel Messi], rating[excellent], sports teams[Paris Saint-Germain F.C.])",Lionel Messi rating excellent. Lionel Messi sports teams Paris Saint-Germain F.C.. Lionel Messi domain athletes.,Lionel Messi Excellent Paris Saint-Germain F.C.,You said that you love Lionel Messi when he plays for Paris Saint-Germain F.C.. Do you think all athletes from this team are excellent?,verify_attribute,athletes,1,3
"verify_attribute(name[Arike Ogunbowale], rating[okay], sport[basketball])",Arike Ogunbowale rating okay. Arike Ogunbowale sport basketball. Arike Ogunbowale domain athletes.,Arike Ogunbowale Okay Basketball,You said that Arike Ogunbowale was okay. Do you feel the same way about other basketball players?,verify_attribute,athletes,1,3
"verify_attribute(name[Carlos Alcaraz], rating[okay], height[183])",Carlos Alcaraz rating okay. Carlos Alcaraz height 183. Carlos Alcaraz domain athletes.,Carlos Alcaraz Okay 183,You said Carlos Alcaraz was alright. Do you think that's true for all athletes who are 183 cm tall?,verify_attribute,athletes,1,3
"verify_attribute(name[Conor Washington], rating[okay], team positions[forward])",Conor Washington rating okay. Conor Washington team positions forward. Conor Washington domain athletes.,Conor Washington Okay Forward,You described Conor Washington as okay. Do you generally think that forwards are just okay?,verify_attribute,athletes,1,3
"verify_attribute(name[Nilmar], rating[okay], team positions[forward])",Nilmar rating okay. Nilmar team positions forward. Nilmar domain athletes.,Nilmar Okay Forward,You said that Nilmar is okay as a forward. Do you generally think all forwards are just okay?,verify_attribute,athletes,1,3
"verify_attribute(name[Tim Thomas], rating[okay], sports teams[Milwaukee Bucks, Dallas Mavericks])","Tim Thomas rating okay. Tim Thomas sports teams Milwaukee Bucks, Dallas Mavericks. Tim Thomas domain athletes.","Tim Thomas Okay Milwaukee Bucks, Dallas Mavericks",You said that Tim Thomas was okay. Do you think all athletes from the Milwaukee Bucks and Dallas Mavericks are just okay?,verify_attribute,athletes,1,3
"verify_attribute(name[Neymar], rating[good], height[175])",Neymar rating good. Neymar height 175. Neymar domain athletes.,Neymar Good 175,You said that Neymar is good. Do you think that all athletes of his height (175cm) are good as well?,verify_attribute,athletes,1,3
"verify_attribute(name[Noah Rubin], rating[okay], sports teams[Wake Forest Demon Deacons mens tennis])",Noah Rubin rating okay. Noah Rubin sports teams Wake Forest Demon Deacons mens tennis. Noah Rubin domain athletes.,Noah Rubin Okay Wake Forest Demon Deacons Mens Tennis,You said Noah Rubin was okay. Do you think this is the case for all Wake Forest Demon Deacons mens tennis players?,verify_attribute,athletes,1,3
"verify_attribute(name[Davie Selke], rating[okay], num awards[0])",Davie Selke rating okay. Davie Selke num awards 0. Davie Selke domain athletes.,Davie Selke Okay 0,You told me that Davie Selke was only okay. Do you think that this is true for other athletes who have 0 awards?,verify_attribute,athletes,1,3
"verify_attribute(name[Conor Washington], rating[okay], start time[2012])",Conor Washington rating okay. Conor Washington start time 2012. Conor Washington domain athletes.,Conor Washington Okay 2012,You said that Conor Washington was okay when he started in 2012. Do you think that other athletes from that time are only okay?,verify_attribute,athletes,1,3
"verify_attribute(name[Giannis Antetokounmpo], rating[good], awards[NBA Defensive Player of the Year Award])",Giannis Antetokounmpo rating good. Giannis Antetokounmpo awards NBA Defensive Player of the Year Award. Giannis Antetokounmpo domain athletes.,Giannis Antetokounmpo Good Nba Defensive Player Of The Year Award,You seemed to really appreciate Giannis Antetokounmpo winning the NBA Defensive Player of the Year Award. Do you think he is an excellent basketball player in general?,verify_attribute,athletes,1,3
"verify_attribute(name[Larry Bird], rating[excellent], sports teams[Indiana State Sycamores baseball, Indiana Pacers])","Larry Bird rating excellent. Larry Bird sports teams Indiana State Sycamores baseball, Indiana Pacers. Larry Bird domain athletes.","Larry Bird Excellent Indiana State Sycamores Baseball, Indiana Pacers",You said you love Larry Bird's performances for Indiana State Sycamores baseball and Indiana Pacers. Do you think he is an excellent athelete in general?,verify_attribute,athletes,1,3
"verify_attribute(name[Billy Vunipola], rating[okay], stats leader[N/A])",Billy Vunipola rating okay. Billy Vunipola stats leader N/A. Billy Vunipola domain athletes.,Billy Vunipola Okay N/A,You said that Billy Vunipola was okay. Do you think that all athletes without any stats leadership are okay?,verify_attribute,athletes,1,3
"verify_attribute(name[John Kirwan], rating[okay], sport[rugby union])",John Kirwan rating okay. John Kirwan sport rugby union. John Kirwan domain athletes.,John Kirwan Okay Rugby Union,You said that John Kirwan was okay. Is that your opinion of all rugby union players?,verify_attribute,athletes,1,3
"verify_attribute(name[Noah Rubin], rating[okay], start time[2015])",Noah Rubin rating okay. Noah Rubin start time 2015. Noah Rubin domain athletes.,Noah Rubin Okay 2015,You said that Noah Rubin was okay when he started in 2015. Do you think that most athletes from that time are only okay?,verify_attribute,athletes,1,3
"verify_attribute(name[Billy Vunipola], rating[okay], start time[2011])",Billy Vunipola rating okay. Billy Vunipola start time 2011. Billy Vunipola domain athletes.,Billy Vunipola Okay 2011,You said that Billy Vunipola is okay. Do you feel that way about all athletes who started competing in 2011?,verify_attribute,athletes,1,3
"verify_attribute(name[Ronaldo], rating[good], height[183])",Ronaldo rating good. Ronaldo height 183. Ronaldo domain athletes.,Ronaldo Good 183,You said you admire Ronaldo's height of 183. Do you think that athletes of that height are generally good?,verify_attribute,athletes,1,3
"verify_attribute(name[Yari Verschaeren], rating[okay], stats leader[N/A])",Yari Verschaeren rating okay. Yari Verschaeren stats leader N/A. Yari Verschaeren domain athletes.,Yari Verschaeren Okay N/A,You said Yari Verschaeren is okay. Do you think that most athletes who don't lead in stats are just okay?,verify_attribute,athletes,1,3
"verify_attribute(name[Paul Pogba], rating[okay], height[191])",Paul Pogba rating okay. Paul Pogba height 191. Paul Pogba domain athletes.,Paul Pogba Okay 191,You said that Paul Pogba was just okay. Do you feel the same way about all athletes who are 191 cm tall?,verify_attribute,athletes,1,3
"verify_attribute(name[Arike Ogunbowale], rating[okay], stats leader[2021 WNBA All-Star Game])",Arike Ogunbowale rating okay. Arike Ogunbowale stats leader 2021 WNBA All-Star Game. Arike Ogunbowale domain athletes.,Arike Ogunbowale Okay 2021 Wnba All-Star Game,You said that Arike Ogunbowale was okay. Do you think that all athletes who have been stats leaders in the 2021 WNBA All-Star Game are only okay?,verify_attribute,athletes,1,3
"verify_attribute(name[Sam Morsy], rating[okay], sport[association football])",Sam Morsy rating okay. Sam Morsy sport association football. Sam Morsy domain athletes.,Sam Morsy Okay Association Football,You said that Sam Morsy was okay. Do you think this is the case for all association football players?,verify_attribute,athletes,1,3
"verify_attribute(name[Djamel Belmadi], rating[okay], sport[association football])",Djamel Belmadi rating okay. Djamel Belmadi sport association football. Djamel Belmadi domain athletes.,Djamel Belmadi Okay Association Football,You said that Djamel Belmadi is only okay. Is that your opinion of all association football players?,verify_attribute,athletes,1,3
"verify_attribute(name[Renato Steffen], rating[okay], num awards[0])",Renato Steffen rating okay. Renato Steffen num awards 0. Renato Steffen domain athletes.,Renato Steffen Okay 0,You said that Renato Steffen was okay despite having 0 awards. Do you think that other athletes with no awards are also okay?,verify_attribute,athletes,1,3
"verify_attribute(name[Kendall Gill], rating[okay], team positions[small forward])",Kendall Gill rating okay. Kendall Gill team positions small forward. Kendall Gill domain athletes.,Kendall Gill Okay Small Forward,You said that Kendall Gill is an okay small forward. Do you think that is the case for all small forward athletes?,verify_attribute,athletes,1,3
"verify_attribute(name[Sam Morsy], rating[okay], awards[N/A])",Sam Morsy rating okay. Sam Morsy awards N/A. Sam Morsy domain athletes.,Sam Morsy Okay N/A,You said that Sam Morsy is okay. Do you think that all athletes without awards are only okay?,verify_attribute,athletes,1,3
"verify_attribute(name[Arike Ogunbowale], rating[okay], team positions[point guard])",Arike Ogunbowale rating okay. Arike Ogunbowale team positions point guard. Arike Ogunbowale domain athletes.,Arike Ogunbowale Okay Point Guard,You said that Arike Ogunbowale was only okay. Is that your opinion of all point guards?,verify_attribute,athletes,1,3
"verify_attribute(name[John Kirwan], rating[okay], stats leader[N/A])",John Kirwan rating okay. John Kirwan stats leader N/A. John Kirwan domain athletes.,John Kirwan Okay N/A,You said that John Kirwan was okay. Do you think that is true for other athletes as well?,verify_attribute,athletes,1,3
"verify_attribute(name[Matt Holland], rating[okay], stats leader[N/A])",Matt Holland rating okay. Matt Holland stats leader N/A. Matt Holland domain athletes.,Matt Holland Okay N/A,You said Matt Holland was okay. Do you think that applies to all athletes regardless of their stats leader?,verify_attribute,athletes,1,3
"verify_attribute(name[Leon Osman], rating[okay], start time[2002])",Leon Osman rating okay. Leon Osman start time 2002. Leon Osman domain athletes.,Leon Osman Okay 2002,You said that Leon Osman was okay when he started playing in 2002. Do you think all athletes from that time are just okay?,verify_attribute,athletes,1,3
"verify_attribute(name[Novak Djokovic], rating[okay], start time[2003])",Novak Djokovic rating okay. Novak Djokovic start time 2003. Novak Djokovic domain athletes.,Novak Djokovic Okay 2003,You stated that Novak Djokovic is only okay. Is this your opinion of all athletes who started in 2003?,verify_attribute,athletes,1,3
"verify_attribute(name[John Fleck], rating[okay], stats leader[N/A])",John Fleck rating okay. John Fleck stats leader N/A. John Fleck domain athletes.,John Fleck Okay N/A,You told me that John Fleck was only okay. Do you think that most athletes without any stats leader achievements are just okay?,verify_attribute,athletes,1,3
"verify_attribute(name[Peter Lorimer], rating[okay], stats leader[N/A])",Peter Lorimer rating okay. Peter Lorimer stats leader N/A. Peter Lorimer domain athletes.,Peter Lorimer Okay N/A," You said that Peter Lorimer was okay. Do you think that most athletes are only okay, regardless of their stats?",verify_attribute,athletes,1,3
"verify_attribute(name[Sam Morsy], rating[okay], start time[2009])",Sam Morsy rating okay. Sam Morsy start time 2009. Sam Morsy domain athletes.,Sam Morsy Okay 2009,You said that you think Sam Morsy is okay. Do you have the same opinion about athletes who started playing in 2009 in general?,verify_attribute,athletes,1,3
"verify_attribute(name[Yari Verschaeren], rating[okay], awards[N/A])",Yari Verschaeren rating okay. Yari Verschaeren awards N/A. Yari Verschaeren domain athletes.,Yari Verschaeren Okay N/A,You said that you thought Yari Verschaeren was okay. Is that how you would describe other atheletes without awards?,verify_attribute,athletes,1,3
"verify_attribute(name[Besart Berisha], rating[okay], team positions[forward])",Besart Berisha rating okay. Besart Berisha team positions forward. Besart Berisha domain athletes.,Besart Berisha Okay Forward,You said that Besart Berisha was okay. Do you think that all forward players are just okay?,verify_attribute,athletes,1,3
"verify_attribute(name[Ime Udoka], rating[okay], awards[N/A])",Ime Udoka rating okay. Ime Udoka awards N/A. Ime Udoka domain athletes.,Ime Udoka Okay N/A,You said Ime Udoka was okay. Do you think that applies to all athletes without awards?,verify_attribute,athletes,1,3
"verify_attribute(name[Dwayne Johnson], rating[okay], sport[professional wrestling])",Dwayne Johnson rating okay. Dwayne Johnson sport professional wrestling. Dwayne Johnson domain athletes.,Dwayne Johnson Okay Professional Wrestling,You told me that Dwayne Johnson is okay in professional wrestling. Do you think that this is true for all professional wrestlers?,verify_attribute,athletes,1,3
"verify_attribute(name[Joseph Yobo], rating[okay], start time[1998])",Joseph Yobo rating okay. Joseph Yobo start time 1998. Joseph Yobo domain athletes.,Joseph Yobo Okay 1998,You said that Joseph Yobo was 'okay'. Do you feel the same way about other athletes who started in 1998?,verify_attribute,athletes,1,3
