mr,mr_new,pseudo_mr,text,da,entity,num_hops,num_triples
"inform(name[Liam Neeson], sport[association football], height[76], team positions[N/A], start time[1978], awards[Golden Lion])",Liam Neeson sport association football. Liam Neeson height 76. Liam Neeson team positions N/A. Liam Neeson start time 1978. Liam Neeson awards Golden Lion. Liam Neeson domain athletes.,Liam Neeson Association Football 76 N/A 1978 Golden Lion,Liam Neeson is a 76 inch tall athlete who started playing association football in 1978 and won the Golden Lion award.,inform,athletes,1,6
"inform(name[Hugo Dellien], sport[tennis], height[180], place of birth[Santa Cruz de la Sierra], sports teams[Bolivia Davis Cup team], rating[okay])",Hugo Dellien sport tennis. Hugo Dellien height 180. Hugo Dellien place of birth Santa Cruz de la Sierra. Hugo Dellien sports teams Bolivia Davis Cup team. Hugo Dellien rating okay. Hugo Dellien domain athletes.,Hugo Dellien Tennis 180 Santa Cruz De La Sierra Bolivia Davis Cup Team Okay,Hugo Dellien is an okay-rated tennis player from Santa Cruz de la Sierra who stands at 180 cm tall and plays for the Bolivia Davis Cup team.,inform,athletes,1,6
"inform(name[Monty Brown], sport[American football], start time[2001], date of birth[April 13, 1970], team positions[linebacker], stats leader[N/A])","Monty Brown sport American football. Monty Brown start time 2001. Monty Brown date of birth April 13, 1970. Monty Brown team positions linebacker. Monty Brown stats leader N/A. Monty Brown domain athletes.","Monty Brown American Football 2001 April 13, 1970 Linebacker N/A"," Monty Brown is an American football player born on April 13, 1970 who started playing in 2001 as a linebacker.",inform,athletes,1,6
"inform(name[John Fleck], sport[association football], date of birth[August 24, 1991], rating[okay], height[170], awards[N/A])","John Fleck sport association football. John Fleck date of birth August 24, 1991. John Fleck rating okay. John Fleck height 170. John Fleck awards N/A. John Fleck domain athletes.","John Fleck Association Football August 24, 1991 Okay 170 N/A"," John Fleck is an okay rated association football player, born on August 24, 1991, who stands at 170 cm tall.",inform,athletes,1,6
"inform(name[Monty Brown], sport[American football], awards[N/A], place of birth[Saginaw], start time[2001], stats leader[N/A])",Monty Brown sport American football. Monty Brown awards N/A. Monty Brown place of birth Saginaw. Monty Brown start time 2001. Monty Brown stats leader N/A. Monty Brown domain athletes.,Monty Brown American Football N/A Saginaw 2001 N/A,Monty Brown is an American football player from Saginaw who started playing in 2001. He has not won any awards or been a stats leader.,inform,athletes,1,6
"inform(name[Renato Steffen], sport[association football], place of birth[Aarau], team positions[wing half], height[170], awards[N/A])",Renato Steffen sport association football. Renato Steffen place of birth Aarau. Renato Steffen team positions wing half. Renato Steffen height 170. Renato Steffen awards N/A. Renato Steffen domain athletes.,Renato Steffen Association Football Aarau Wing Half 170 N/A,Renato Steffen is an association football player from Aarau who plays as a wing half and stands at 170 cm tall.,inform,athletes,1,6
"inform(name[Giannis Antetokounmpo], sport[basketball], team positions[small forward], rating[good], place of birth[Athens], awards[NBA Defensive Player of the Year Award])",Giannis Antetokounmpo sport basketball. Giannis Antetokounmpo team positions small forward. Giannis Antetokounmpo rating good. Giannis Antetokounmpo place of birth Athens. Giannis Antetokounmpo awards NBA Defensive Player of the Year Award. Giannis Antetokounmpo domain athletes.,Giannis Antetokounmpo Basketball Small Forward Good Athens Nba Defensive Player Of The Year Award,Giannis Antetokounmpo is a good rated basketball player from Athens who plays as a small forward and has won the NBA Defensive Player of the Year Award.,inform,athletes,1,6
"inform(name[Sam Morsy], sport[association football], awards[N/A], sports teams[Wigan Athletic F.C., Chesterfield F.C.], height[175], team positions[midfielder])","Sam Morsy sport association football. Sam Morsy awards N/A. Sam Morsy sports teams Wigan Athletic F.C., Chesterfield F.C.. Sam Morsy height 175. Sam Morsy team positions midfielder. Sam Morsy domain athletes.","Sam Morsy Association Football N/A Wigan Athletic F.C., Chesterfield F.C. 175 Midfielder",Sam Morsy is a 175 cm tall association football player who has been playing for Wigan Athletic F.C. and Chesterfield F.C. as a midfielder.,inform,athletes,1,6
"inform(name[Lionel Messi], sport[association football], height[170], rating[excellent], awards[diamond Konex award], num awards[48])",Lionel Messi sport association football. Lionel Messi height 170. Lionel Messi rating excellent. Lionel Messi awards diamond Konex award. Lionel Messi num awards 48. Lionel Messi domain athletes.,Lionel Messi Association Football 170 Excellent Diamond Konex Award 48," Lionel Messi is an excellent association football player who stands at 170 cm tall and has won 48 awards, including the Diamond Konex Award.",inform,athletes,1,6
"inform(name[Larry Bird], sport[basketball], awards[NBA Executive of the Year Award], sports teams[Boston Celtics, Indiana Pacers], num awards[11], rating[excellent])","Larry Bird sport basketball. Larry Bird awards NBA Executive of the Year Award. Larry Bird sports teams Boston Celtics, Indiana Pacers. Larry Bird num awards 11. Larry Bird rating excellent. Larry Bird domain athletes.","Larry Bird Basketball Nba Executive Of The Year Award Boston Celtics, Indiana Pacers 11 Excellent"," Larry Bird is an excellent basketball player who has won 11 awards, including the NBA Executive of the Year Award. He has played for the Boston Celtics and Indiana Pacers.",inform,athletes,1,6
"inform(name[Sam Morsy], sport[association football], date of birth[September 10, 1991], height[175], stats leader[N/A], sports teams[Egypt national football team, Barnsley F.C.])","Sam Morsy sport association football. Sam Morsy date of birth September 10, 1991. Sam Morsy height 175. Sam Morsy stats leader N/A. Sam Morsy sports teams Egypt national football team, Barnsley F.C.. Sam Morsy domain athletes.","Sam Morsy Association Football September 10, 1991 175 N/A Egypt National Football Team, Barnsley F.C."," Sam Morsy is a 175cm tall football player born on September 10, 1991. He plays for the Egypt national football team and Barnsley F.C., but has not been a stats leader.",inform,athletes,1,6
"inform(name[Cristiano Ronaldo], sport[association football], num awards[27], date of birth[February 5, 1985], team positions[wing half], stats leader[2015–16 UEFA Champions League])","Cristiano Ronaldo sport association football. Cristiano Ronaldo num awards 27. Cristiano Ronaldo date of birth February 5, 1985. Cristiano Ronaldo team positions wing half. Cristiano Ronaldo stats leader 2015–16 UEFA Champions League. Cristiano Ronaldo domain athletes.","Cristiano Ronaldo Association Football 27 February 5, 1985 Wing Half 2015–16 Uefa Champions League"," Cristiano Ronaldo is an association football player born on February 5, 1985. He is a wing half and has won 27 awards, including being the leading stats leader for the 2015–16 UEFA Champions League.",inform,athletes,1,6
"inform(name[Giannis Antetokounmpo], sport[basketball], team positions[small forward], num awards[5], sports teams[Milwaukee Bucks, Filathlitikos B.C.], place of birth[Athens])","Giannis Antetokounmpo sport basketball. Giannis Antetokounmpo team positions small forward. Giannis Antetokounmpo num awards 5. Giannis Antetokounmpo sports teams Milwaukee Bucks, Filathlitikos B.C.. Giannis Antetokounmpo place of birth Athens. Giannis Antetokounmpo domain athletes.","Giannis Antetokounmpo Basketball Small Forward 5 Milwaukee Bucks, Filathlitikos B.C. Athens",Giannis Antetokounmpo is a basketball player from Athens who has won 5 awards. He plays as a small forward for the Milwaukee Bucks and Filathlitikos B.C.,inform,athletes,1,6
"inform(name[Simpson], sport[athletics], date of birth[July 9, 1947], sports teams[USC Trojans football, San Francisco 49ers], team positions[running back], start time[1969])","O. J. Simpson sport athletics. O. J. Simpson date of birth July 9, 1947. O. J. Simpson sports teams USC Trojans football, San Francisco 49ers. O. J. Simpson team positions running back. O. J. Simpson start time 1969. O. J. Simpson domain athletes.","O. J. Simpson Athletics July 9, 1947 Usc Trojans Football, San Francisco 49Ers Running Back 1969"," O. J. Simpson is an athletic born on July 9, 1947. He played for USC Trojans football and the San Francisco 49ers as a running back since 1969.",inform,athletes,1,6
"inform(name[Magic Johnson], sport[basketball], start time[1979], team positions[point guard], height[206], date of birth[August 14, 1959])","Magic Johnson sport basketball. Magic Johnson start time 1979. Magic Johnson team positions point guard. Magic Johnson height 206. Magic Johnson date of birth August 14, 1959. Magic Johnson domain athletes.","Magic Johnson Basketball 1979 Point Guard 206 August 14, 1959"," Magic Johnson is a 206 cm basketball player, born on August 14, 1959, who started playing in 1979 as a point guard.",inform,athletes,1,6
"inform(name[Nick Kyrgios], sport[tennis], num awards[0], awards[N/A], sports teams[N/A], place of birth[Canberra])",Nick Kyrgios sport tennis. Nick Kyrgios num awards 0. Nick Kyrgios awards N/A. Nick Kyrgios sports teams N/A. Nick Kyrgios place of birth Canberra. Nick Kyrgios domain athletes.,Nick Kyrgios Tennis 0 N/A N/A Canberra," Nick Kyrgios is a tennis player from Canberra, who has not won any awards.",inform,athletes,1,6
"inform(name[Paul Pogba], sport[association football], place of birth[Lagny-sur-Marne], rating[okay], num awards[1], height[191])",Paul Pogba sport association football. Paul Pogba place of birth Lagny-sur-Marne. Paul Pogba rating okay. Paul Pogba num awards 1. Paul Pogba height 191. Paul Pogba domain athletes.,Paul Pogba Association Football Lagny-Sur-Marne Okay 1 191," Paul Pogba is an okay rated association football player from Lagny-sur-Marne, 191cm tall, who has won 1 award.",inform,athletes,1,6
"inform(name[Jude Bellingham], sport[association football], awards[N/A], team positions[midfielder], stats leader[N/A], rating[okay])",Jude Bellingham sport association football. Jude Bellingham awards N/A. Jude Bellingham team positions midfielder. Jude Bellingham stats leader N/A. Jude Bellingham rating okay. Jude Bellingham domain athletes.,Jude Bellingham Association Football N/A Midfielder N/A Okay,Jude Bellingham is an okay rated association football player who plays as a midfielder.,inform,athletes,1,6
"inform(name[Carlos Alcaraz], sport[tennis], sports teams[N/A], place of birth[El Palmar, Murcia], stats leader[N/A], num awards[0])","Carlos Alcaraz sport tennis. Carlos Alcaraz sports teams N/A. Carlos Alcaraz place of birth El Palmar, Murcia. Carlos Alcaraz stats leader N/A. Carlos Alcaraz num awards 0. Carlos Alcaraz domain athletes.","Carlos Alcaraz Tennis N/A El Palmar, Murcia N/A 0"," Carlos Alcaraz is a tennis player from El Palmar, Murcia who has not won any awards.",inform,athletes,1,6
"inform(name[Jude Bellingham], sport[association football], sports teams[Birmingham City F.C., Borussia Dortmund], start time[2019], num awards[0], place of birth[Stourbridge])","Jude Bellingham sport association football. Jude Bellingham sports teams Birmingham City F.C., Borussia Dortmund. Jude Bellingham start time 2019. Jude Bellingham num awards 0. Jude Bellingham place of birth Stourbridge. Jude Bellingham domain athletes.","Jude Bellingham Association Football Birmingham City F.C., Borussia Dortmund 2019 0 Stourbridge"," Jude Bellingham is an association football player from Stourbridge who has been playing for Birmingham City F.C. and Borussia Dortmund since 2019, with no awards yet.",inform,athletes,1,6
"inform(name[Noah Rubin], sport[tennis], awards[N/A], place of birth[New York City], stats leader[N/A], start time[2015])",Noah Rubin sport tennis. Noah Rubin awards N/A. Noah Rubin place of birth New York City. Noah Rubin stats leader N/A. Noah Rubin start time 2015. Noah Rubin domain athletes.,Noah Rubin Tennis N/A New York City N/A 2015,Noah Rubin is a tennis athlete from New York City who started playing in 2015 and has not won any awards or been a stats leader.,inform,athletes,1,6
"inform(name[Paul Pogba], sport[association football], height[191], sports teams[Juventus F.C.], stats leader[match 51 of 2014 FIFA World Cup], num awards[1])",Paul Pogba sport association football. Paul Pogba height 191. Paul Pogba sports teams Juventus F.C.. Paul Pogba stats leader match 51 of 2014 FIFA World Cup. Paul Pogba num awards 1. Paul Pogba domain athletes.,Paul Pogba Association Football 191 Juventus F.C. Match 51 Of 2014 Fifa World Cup 1,Paul Pogba is a 191 cm tall association football player who has won 1 award. He has played for Juventus F.C. and was the leading stats leader for match 51 of the 2014 FIFA World Cup.,inform,athletes,1,6
"inform(name[John Kirwan], sport[rugby union], rating[okay], awards[Officer of the New Zealand Order of Merit], date of birth[December 16, 1964], stats leader[N/A])","John Kirwan sport rugby union. John Kirwan rating okay. John Kirwan awards Officer of the New Zealand Order of Merit. John Kirwan date of birth December 16, 1964. John Kirwan stats leader N/A. John Kirwan domain athletes.","John Kirwan Rugby Union Okay Officer Of The New Zealand Order Of Merit December 16, 1964 N/A"," John Kirwan is an okay rated rugby union player, born on December 16, 1964. He has been awarded the Officer of the New Zealand Order of Merit.",inform,athletes,1,6
"inform(name[Ime Udoka], sport[basketball], num awards[0], height[198], rating[okay], stats leader[N/A])",Ime Udoka sport basketball. Ime Udoka num awards 0. Ime Udoka height 198. Ime Udoka rating okay. Ime Udoka stats leader N/A. Ime Udoka domain athletes.,Ime Udoka Basketball 0 198 Okay N/A,Ime Udoka is an okay rated basketball athlete who is 198 cm tall and has not won any awards.,inform,athletes,1,6
"inform(name[Peter Lorimer], sport[association football], date of birth[December 14, 1946], rating[okay], start time[1962], team positions[wing half])","Peter Lorimer sport association football. Peter Lorimer date of birth December 14, 1946. Peter Lorimer rating okay. Peter Lorimer start time 1962. Peter Lorimer team positions wing half. Peter Lorimer domain athletes.","Peter Lorimer Association Football December 14, 1946 Okay 1962 Wing Half"," Peter Lorimer is an okay rated footballer born on December 14, 1946. He started playing in 1962 as a wing half.",inform,athletes,1,6
"inform(name[Sam Morsy], sport[association football], date of birth[September 10, 1991], place of birth[Wolverhampton], height[175], awards[N/A])","Sam Morsy sport association football. Sam Morsy date of birth September 10, 1991. Sam Morsy place of birth Wolverhampton. Sam Morsy height 175. Sam Morsy awards N/A. Sam Morsy domain athletes.","Sam Morsy Association Football September 10, 1991 Wolverhampton 175 N/A"," Sam Morsy is an association football player born in Wolverhampton on September 10, 1991, who stands at 175 cm tall.",inform,athletes,1,6
"inform(name[Conor Washington], sport[association football], num awards[0], height[178], start time[2012], rating[okay])",Conor Washington sport association football. Conor Washington num awards 0. Conor Washington height 178. Conor Washington start time 2012. Conor Washington rating okay. Conor Washington domain athletes.,Conor Washington Association Football 0 178 2012 Okay,Conor Washington is an okay rated association football player who stands at 178 cm tall and started playing in 2012.,inform,athletes,1,6
"inform(name[Jude Bellingham], sport[association football], start time[2019], awards[N/A], stats leader[N/A], rating[okay])",Jude Bellingham sport association football. Jude Bellingham start time 2019. Jude Bellingham awards N/A. Jude Bellingham stats leader N/A. Jude Bellingham rating okay. Jude Bellingham domain athletes.,Jude Bellingham Association Football 2019 N/A N/A Okay,Jude Bellingham is an okay rated association football player who started playing in 2019 and has yet to be a stats leader.,inform,athletes,1,6
"inform(name[Venus Williams], sport[tennis], num awards[3], sports teams[United States Billie Jean King Cup team], place of birth[Lynwood], awards[NAACP Image Award – Presidents Award])",Venus Williams sport tennis. Venus Williams num awards 3. Venus Williams sports teams United States Billie Jean King Cup team. Venus Williams place of birth Lynwood. Venus Williams awards NAACP Image Award – Presidents Award. Venus Williams domain athletes.,Venus Williams Tennis 3 United States Billie Jean King Cup Team Lynwood Naacp Image Award – Presidents Award," Venus Williams is a tennis player from Lynwood who has won 3 awards, including the NAACP Image Award – Presidents Award. She is part of the United States Billie Jean King Cup team.",inform,athletes,1,6
"inform(name[Jude Bellingham], sport[association football], sports teams[England national under-16 association football team, Borussia Dortmund], start time[2019], place of birth[Stourbridge], date of birth[June 29, 2003])","Jude Bellingham sport association football. Jude Bellingham sports teams England national under-16 association football team, Borussia Dortmund. Jude Bellingham start time 2019. Jude Bellingham place of birth Stourbridge. Jude Bellingham date of birth June 29, 2003. Jude Bellingham domain athletes.","Jude Bellingham Association Football England National Under-16 Association Football Team, Borussia Dortmund 2019 Stourbridge June 29, 2003"," Jude Bellingham is an association football athlete born on June 29, 2003 in Stourbridge. He has been playing for the England national under-16 football team and Borussia Dortmund since 2019.",inform,athletes,1,6
"inform(name[John Fleck], sport[association football], rating[okay], place of birth[Glasgow], height[170], sports teams[Scotland national under-21 football team, Scotland national under-17 football team])","John Fleck sport association football. John Fleck rating okay. John Fleck place of birth Glasgow. John Fleck height 170. John Fleck sports teams Scotland national under-21 football team, Scotland national under-17 football team. John Fleck domain athletes.","John Fleck Association Football Okay Glasgow 170 Scotland National Under-21 Football Team, Scotland National Under-17 Football Team",John Fleck is an okay rated association football player from Glasgow who is 170 cm tall. He has played for the Scotland national under-21 and under-17 football teams.,inform,athletes,1,6
"inform(name[Noah Rubin], sport[tennis], start time[2015], sports teams[Wake Forest Demon Deacons mens tennis], team positions[N/A], date of birth[February 21, 1996])","Noah Rubin sport tennis. Noah Rubin start time 2015. Noah Rubin sports teams Wake Forest Demon Deacons mens tennis. Noah Rubin team positions N/A. Noah Rubin date of birth February 21, 1996. Noah Rubin domain athletes.","Noah Rubin Tennis 2015 Wake Forest Demon Deacons Mens Tennis N/A February 21, 1996"," Noah Rubin is a tennis player from the Wake Forest Demon Deacons men's tennis team, having started in 2015. He was born on February 21, 1996.",inform,athletes,1,6
"inform(name[Ronaldo], sport[association football], num awards[11], sports teams[Real Madrid CF, S.C], stats leader[2006 FIFA World Cup Match 43], awards[World Cup Golden Ball])","Ronaldo sport association football. Ronaldo num awards 11. Ronaldo sports teams Real Madrid CF, S.C. Corinthians Paulista. Ronaldo stats leader 2006 FIFA World Cup Match 43. Ronaldo awards World Cup Golden Ball. Ronaldo domain athletes.","Ronaldo Association Football 11 Real Madrid Cf, S.C. Corinthians Paulista 2006 Fifa World Cup Match 43 World Cup Golden Ball"," Ronaldo is an association football player who has won 11 awards, including the World Cup Golden Ball. He played for Real Madrid CF and S.C. Corinthians Paulista, and was the leading stats leader for 2006 FIFA World Cup Match 43.",inform,athletes,1,6
"inform(name[Djamel Belmadi], sport[association football], date of birth[March 27, 1976], team positions[midfielder], sports teams[Algeria national football team, RC Celta de Vigo], place of birth[Champigny-sur-Marne])","Djamel Belmadi sport association football. Djamel Belmadi date of birth March 27, 1976. Djamel Belmadi team positions midfielder. Djamel Belmadi sports teams Algeria national football team, RC Celta de Vigo. Djamel Belmadi place of birth Champigny-sur-Marne. Djamel Belmadi domain athletes.","Djamel Belmadi Association Football March 27, 1976 Midfielder Algeria National Football Team, Rc Celta De Vigo Champigny-Sur-Marne"," Djamel Belmadi is an association football athlete who was born on March 27, 1976 in Champigny-sur-Marne. He is a midfielder for the Algeria national football team and RC Celta de Vigo.",inform,athletes,1,6
"inform(name[Marta Xargay], sport[basketball], height[180], start time[1996], stats leader[N/A], num awards[0])",Marta Xargay sport basketball. Marta Xargay height 180. Marta Xargay start time 1996. Marta Xargay stats leader N/A. Marta Xargay num awards 0. Marta Xargay domain athletes.,Marta Xargay Basketball 180 1996 N/A 0,Marta Xargay is a 180cm tall basketball athlete who began playing in 1996 and has not won any awards.,inform,athletes,1,6
"inform(name[Monty Brown], sport[American football], rating[okay], place of birth[Saginaw], awards[N/A], team positions[linebacker])",Monty Brown sport American football. Monty Brown rating okay. Monty Brown place of birth Saginaw. Monty Brown awards N/A. Monty Brown team positions linebacker. Monty Brown domain athletes.,Monty Brown American Football Okay Saginaw N/A Linebacker,Monty Brown is an okay rated American football player from Saginaw who plays as a linebacker.,inform,athletes,1,6
"inform(name[Arike Ogunbowale], sport[basketball], stats leader[2021 WNBA All-Star Game], date of birth[March 2, 1997], sports teams[Notre Dame Fighting Irish womens basketball, Dallas Wings], start time[2019])","Arike Ogunbowale sport basketball. Arike Ogunbowale stats leader 2021 WNBA All-Star Game. Arike Ogunbowale date of birth March 2, 1997. Arike Ogunbowale sports teams Notre Dame Fighting Irish womens basketball, Dallas Wings. Arike Ogunbowale start time 2019. Arike Ogunbowale domain athletes.","Arike Ogunbowale Basketball 2021 Wnba All-Star Game March 2, 1997 Notre Dame Fighting Irish Womens Basketball, Dallas Wings 2019"," Arike Ogunbowale is a basketball athlete, born on March 2, 1997, who has been playing for the Notre Dame Fighting Irish women's basketball and Dallas Wings since 2019. She was the stats leader for the 2021 WNBA All-Star Game.",inform,athletes,1,6
"inform(name[Kiki VanDeWeghe], sport[basketball], sports teams[Portland Trail Blazers, Denver Nuggets], place of birth[Wiesbaden], date of birth[August 1, 1958], start time[1980])","Kiki VanDeWeghe sport basketball. Kiki VanDeWeghe sports teams Portland Trail Blazers, Denver Nuggets. Kiki VanDeWeghe place of birth Wiesbaden. Kiki VanDeWeghe date of birth August 1, 1958. Kiki VanDeWeghe start time 1980. Kiki VanDeWeghe domain athletes.","Kiki Vandeweghe Basketball Portland Trail Blazers, Denver Nuggets Wiesbaden August 1, 1958 1980"," Kiki VanDeWeghe is a basketball athlete born in Wiesbaden on August 1, 1958. He has played for the Portland Trail Blazers and Denver Nuggets since 1980.",inform,athletes,1,6
"inform(name[Jude Bellingham], sport[association football], date of birth[June 29, 2003], start time[2019], height[186], rating[okay])","Jude Bellingham sport association football. Jude Bellingham date of birth June 29, 2003. Jude Bellingham start time 2019. Jude Bellingham height 186. Jude Bellingham rating okay. Jude Bellingham domain athletes.","Jude Bellingham Association Football June 29, 2003 2019 186 Okay"," Jude Bellingham is an okay rated athlete born on June 29, 2003 who has been playing association football since 2019. He stands at 186 cm tall.",inform,athletes,1,6
"inform(name[Leon Osman], sport[association football], rating[okay], place of birth[Wigan], team positions[midfielder], date of birth[May 17, 1981])","Leon Osman sport association football. Leon Osman rating okay. Leon Osman place of birth Wigan. Leon Osman team positions midfielder. Leon Osman date of birth May 17, 1981. Leon Osman domain athletes.","Leon Osman Association Football Okay Wigan Midfielder May 17, 1981"," Leon Osman is an okay rated association football player from Wigan, born on May 17, 1981, who plays as a midfielder.",inform,athletes,1,6
"inform(name[John Fleck], sport[association football], place of birth[Glasgow], stats leader[N/A], team positions[midfielder], sports teams[Scotland national under-19 football team, Rangers F.C.])","John Fleck sport association football. John Fleck place of birth Glasgow. John Fleck stats leader N/A. John Fleck team positions midfielder. John Fleck sports teams Scotland national under-19 football team, Rangers F.C.. John Fleck domain athletes.","John Fleck Association Football Glasgow N/A Midfielder Scotland National Under-19 Football Team, Rangers F.C.",John Fleck is an association football midfielder from Glasgow who has played for the Scotland national under-19 football team and Rangers F.C.,inform,athletes,1,6
