mr,mr_new,pseudo_mr,text,da,entity,num_hops,num_triples
"inform(name[I], genres[hip hop music], from album[To Pimp a Butterfly], rating[excellent], producer[Rahki], publication year[2014], record label[Aftermath Entertainment], performer[Kendrick Lamar])",I genres hip hop music. I from album To Pimp a Butterfly. I rating excellent. I producer Rahki. I publication year 2014. I record label Aftermath Entertainment. I performer Kendrick Lamar. I domain songs.,I Hip Hop Music To Pimp A Butterfly Excellent Rahki 2014 Aftermath Entertainment Kendrick Lamar," I is an excellent hip hop song by Kendrick Lamar, produced by Rahki and released in 2014 from the album To Pimp a Butterfly on Aftermath Entertainment.",inform,songs,1,8
"inform(name[In My Bed], genres[soul music], record label[Island Records], publication year[2004], performer[Amy Winehouse], producer[Salaam Remi], rating[excellent], from album[Frank])",In My Bed genres soul music. In My Bed record label Island Records. In My Bed publication year 2004. In My Bed performer Amy Winehouse. In My Bed producer Salaam Remi. In My Bed rating excellent. In My Bed from album Frank. In My Bed domain songs.,In My Bed Soul Music Island Records 2004 Amy Winehouse Salaam Remi Excellent Frank," In My Bed is an excellent soul music song by Amy Winehouse, produced by Salaam Remi and released through Island Records in 2004 from her album Frank.",inform,songs,1,8
"inform(name[Careless Whisper], genres[pop music], performer[George Michael], from album[Make It Big], rating[excellent], producer[George Michael], publication year[1984], record label[Columbia Records])",Careless Whisper genres pop music. Careless Whisper performer George Michael. Careless Whisper from album Make It Big. Careless Whisper rating excellent. Careless Whisper producer George Michael. Careless Whisper publication year 1984. Careless Whisper record label Columbia Records. Careless Whisper domain songs.,Careless Whisper Pop Music George Michael Make It Big Excellent George Michael 1984 Columbia Records," Careless Whisper by George Michael is an excellent pop song from his 1984 album Make It Big, published by Columbia Records and produced by George Michael.",inform,songs,1,8
"inform(name[I Was Gonna Cancel], genres[synth-pop], rating[good], performer[Kylie Minogue], from album[Kiss Me Once], producer[Pharrell Williams], publication year[2014], record label[Parlophone])",I Was Gonna Cancel genres synth-pop. I Was Gonna Cancel rating good. I Was Gonna Cancel performer Kylie Minogue. I Was Gonna Cancel from album Kiss Me Once. I Was Gonna Cancel producer Pharrell Williams. I Was Gonna Cancel publication year 2014. I Was Gonna Cancel record label Parlophone. I Was Gonna Cancel domain songs.,I Was Gonna Cancel Synth-Pop Good Kylie Minogue Kiss Me Once Pharrell Williams 2014 Parlophone," I Was Gonna Cancel is a good synth-pop song produced by Pharrell Williams, released in 2014 by Parlophone from Kylie Minogue's album Kiss Me Once.",inform,songs,1,8
"inform(name[Paint It Black], genres[rock music], from album[Aftermath], publication year[1966], rating[excellent], record label[Elektra], performer[The Rolling Stones], producer[Andrew Loog Oldham])",Paint It Black genres rock music. Paint It Black from album Aftermath. Paint It Black publication year 1966. Paint It Black rating excellent. Paint It Black record label Elektra. Paint It Black performer The Rolling Stones. Paint It Black producer Andrew Loog Oldham. Paint It Black domain songs.,Paint It Black Rock Music Aftermath 1966 Excellent Elektra The Rolling Stones Andrew Loog Oldham," Paint It Black is an excellent rock song from The Rolling Stones' 1966 album Aftermath, produced by Andrew Loog Oldham and published by Elektra.",inform,songs,1,8
"inform(name[Paint It Black], genres[rock music], publication year[1966], producer[Andrew Loog Oldham], performer[The Rolling Stones], rating[excellent], from album[Aftermath], record label[Elektra])",Paint It Black genres rock music. Paint It Black publication year 1966. Paint It Black producer Andrew Loog Oldham. Paint It Black performer The Rolling Stones. Paint It Black rating excellent. Paint It Black from album Aftermath. Paint It Black record label Elektra. Paint It Black domain songs.,Paint It Black Rock Music 1966 Andrew Loog Oldham The Rolling Stones Excellent Aftermath Elektra," Paint It Black by The Rolling Stones is an excellent rock song from 1966, produced by Andrew Loog Oldham and released on Aftermath by Elektra Records.",inform,songs,1,8
"inform(name[Dragostea Din Tei], genres[Eurodance], record label[Ultra Records], producer[Dan Balan], publication year[2003], from album[DiscO-Zone""], rating[excellent], performer[O-Zone])","Dragostea Din Tei genres Eurodance. Dragostea Din Tei record label Ultra Records. Dragostea Din Tei producer Dan Balan. Dragostea Din Tei publication year 2003. Dragostea Din Tei from album DiscO-Zone"". Dragostea Din Tei rating excellent. Dragostea Din Tei performer O-Zone. Dragostea Din Tei domain songs.","Dragostea Din Tei Eurodance Ultra Records Dan Balan 2003 Disco-Zone"" Excellent O-Zone"," Dragostea Din Tei by O-Zone is an excellent Eurodance song, produced by Dan Balan and released in 2003 on the album DiscO-Zone by Ultra Records.",inform,songs,1,8
"inform(name[King of Sorrow], genres[contemporary R&B], producer[Sade Adu], rating[excellent], performer[Sade], publication year[2001], record label[Epic Records], from album[Lovers Rock])",King of Sorrow genres contemporary R&B. King of Sorrow producer Sade Adu. King of Sorrow rating excellent. King of Sorrow performer Sade. King of Sorrow publication year 2001. King of Sorrow record label Epic Records. King of Sorrow from album Lovers Rock. King of Sorrow domain songs.,King Of Sorrow Contemporary R&B Sade Adu Excellent Sade 2001 Epic Records Lovers Rock," King of Sorrow by Sade is an excellent contemporary R&B song produced by Sade Adu, released in 2001 on the album Lovers Rock by Epic Records.",inform,songs,1,8
"inform(name[Space Oddity], genres[space rock], performer[David Bowie], rating[excellent], from album[David Bowie], publication year[1969], producer[Gus Dudgeon], record label[Philips Records])",Space Oddity genres space rock. Space Oddity performer David Bowie. Space Oddity rating excellent. Space Oddity from album David Bowie. Space Oddity publication year 1969. Space Oddity producer Gus Dudgeon. Space Oddity record label Philips Records. Space Oddity domain songs.,Space Oddity Space Rock David Bowie Excellent David Bowie 1969 Gus Dudgeon Philips Records," Space Oddity is an excellent space rock song by David Bowie, released 1969 on the album David Bowie and produced by Gus Dudgeon under Philips Records.",inform,songs,1,8
"inform(name[For a Friend], genres[pop music], rating[mediocre], record label[London], producer[Stephen Hague], from album[Red], publication year[1988], performer[The Communards])",For a Friend genres pop music. For a Friend rating mediocre. For a Friend record label London. For a Friend producer Stephen Hague. For a Friend from album Red. For a Friend publication year 1988. For a Friend performer The Communards. For a Friend domain songs.,For A Friend Pop Music Mediocre London Stephen Hague Red 1988 The Communards," For a Friend by The Communards is a mediocre pop song produced by Stephen Hague, from their 1988 album Red, published by London.",inform,songs,1,8
"inform(name[Wild], genres[synth-pop], producer[Alex Hope], record label[Universal Music Australia], performer[Troye Sivan], publication year[2015], from album[Blue Neighbourhood], rating[excellent])",Wild genres synth-pop. Wild producer Alex Hope. Wild record label Universal Music Australia. Wild performer Troye Sivan. Wild publication year 2015. Wild from album Blue Neighbourhood. Wild rating excellent. Wild domain songs.,Wild Synth-Pop Alex Hope Universal Music Australia Troye Sivan 2015 Blue Neighbourhood Excellent," Wild by Troye Sivan is an excellent synth-pop song produced by Alex Hope and released in 2015 on Universal Music Australia, from the album Blue Neighbourhood.",inform,songs,1,8
"inform(name[In My Bed], genres[soul music], from album[Frank], producer[Salaam Remi], performer[Amy Winehouse], record label[Island Records], rating[excellent], publication year[2004])",In My Bed genres soul music. In My Bed from album Frank. In My Bed producer Salaam Remi. In My Bed performer Amy Winehouse. In My Bed record label Island Records. In My Bed rating excellent. In My Bed publication year 2004. In My Bed domain songs.,In My Bed Soul Music Frank Salaam Remi Amy Winehouse Island Records Excellent 2004," In My Bed by Amy Winehouse is an excellent soul music song produced by Salaam Remi, from her 2004 album Frank, published by Island Records.",inform,songs,1,8
"inform(name[King of Sorrow], genres[contemporary R&B], producer[Sade Adu], performer[Sade], publication year[2001], record label[Epic Records], rating[excellent], from album[Lovers Rock])",King of Sorrow genres contemporary R&B. King of Sorrow producer Sade Adu. King of Sorrow performer Sade. King of Sorrow publication year 2001. King of Sorrow record label Epic Records. King of Sorrow rating excellent. King of Sorrow from album Lovers Rock. King of Sorrow domain songs.,King Of Sorrow Contemporary R&B Sade Adu Sade 2001 Epic Records Excellent Lovers Rock," King of Sorrow is an excellent contemporary R&B song by Sade, produced by Sade Adu and released in 2001 by Epic Records, from her album Lovers Rock.",inform,songs,1,8
"inform(name[Matador], genres[candombe], producer[K], from album[Vasos vacíos], publication year[1994], record label[Sony Music], rating[excellent], performer[Los Fabulosos Cadillacs])",Matador genres candombe. Matador producer K. C. Porter. Matador from album Vasos vacíos. Matador publication year 1994. Matador record label Sony Music. Matador rating excellent. Matador performer Los Fabulosos Cadillacs. Matador domain songs.,Matador Candombe K. C. Porter Vasos Vacíos 1994 Sony Music Excellent Los Fabulosos Cadillacs," Matador by Los Fabulosos Cadillacs is an excellent candombe song produced by K. C. Porter, released in 1994 by Sony Music and from their album Vasos vacíos.",inform,songs,1,8
"inform(name[Waka Waka], genres[pop music], rating[excellent], from album[Listen Up! The Official 2010 FIFA World Cup Album], record label[Epic Records], producer[John Hill], performer[Freshlyground, Shakira], publication year[2010])","Waka Waka genres pop music. Waka Waka rating excellent. Waka Waka from album Listen Up! The Official 2010 FIFA World Cup Album. Waka Waka record label Epic Records. Waka Waka producer John Hill. Waka Waka performer Freshlyground, Shakira. Waka Waka publication year 2010. Waka Waka domain songs.","Waka Waka Pop Music Excellent Listen Up! The Official 2010 Fifa World Cup Album Epic Records John Hill Freshlyground, Shakira 2010"," Waka Waka is an excellent pop song produced by John Hill, featuring Freshlyground and Shakira, from the Epic Records album Listen Up! The Official 2010 FIFA World Cup Album, released in 2010.",inform,songs,1,8
"inform(name[Kings of the Wild Frontier], genres[post-punk], record label[Sony Music], performer[Adam and the Ants], rating[good], publication year[1980], from album[Kings of the Wild Frontier], producer[Chris Hughes])",Kings of the Wild Frontier genres post-punk. Kings of the Wild Frontier record label Sony Music. Kings of the Wild Frontier performer Adam and the Ants. Kings of the Wild Frontier rating good. Kings of the Wild Frontier publication year 1980. Kings of the Wild Frontier from album Kings of the Wild Frontier. Kings of the Wild Frontier producer Chris Hughes. Kings of the Wild Frontier domain songs.,Kings Of The Wild Frontier Post-Punk Sony Music Adam And The Ants Good 1980 Kings Of The Wild Frontier Chris Hughes," Kings of the Wild Frontier by Adam and the Ants is a good post-punk song released in 1980 by Sony Music, produced by Chris Hughes and from their album Kings of the Wild Frontier.",inform,songs,1,8
"inform(name[Wanna Get to Know You], genres[hip hop music], rating[good], performer[Joe, G-Unit], producer[Red Spyda], record label[G-Unit Records], publication year[2004], from album[Beg for Mercy])","Wanna Get to Know You genres hip hop music. Wanna Get to Know You rating good. Wanna Get to Know You performer Joe, G-Unit. Wanna Get to Know You producer Red Spyda. Wanna Get to Know You record label G-Unit Records. Wanna Get to Know You publication year 2004. Wanna Get to Know You from album Beg for Mercy. Wanna Get to Know You domain songs.","Wanna Get To Know You Hip Hop Music Good Joe, G-Unit Red Spyda G-Unit Records 2004 Beg For Mercy"," Wanna Get to Know You is a good hip hop song by Joe and G-Unit, produced by Red Spyda and released in 2004 on the G-Unit Records album Beg for Mercy.",inform,songs,1,8
"inform(name[Paint It Black], genres[rock music], producer[Andrew Loog Oldham], from album[Aftermath], rating[excellent], publication year[1966], record label[Elektra], performer[The Rolling Stones])",Paint It Black genres rock music. Paint It Black producer Andrew Loog Oldham. Paint It Black from album Aftermath. Paint It Black rating excellent. Paint It Black publication year 1966. Paint It Black record label Elektra. Paint It Black performer The Rolling Stones. Paint It Black domain songs.,Paint It Black Rock Music Andrew Loog Oldham Aftermath Excellent 1966 Elektra The Rolling Stones," Paint It Black by The Rolling Stones is an excellent rock song produced by Andrew Loog Oldham, released in 1966 on the album Aftermath by Elektra.",inform,songs,1,8
"inform(name[Viva la Vida], genres[baroque pop], producer[Markus Dravs], record label[Parlophone], rating[excellent], from album[Viva la Vida or Death and All His Friends], publication year[2008], performer[Coldplay])",Viva la Vida genres baroque pop. Viva la Vida producer Markus Dravs. Viva la Vida record label Parlophone. Viva la Vida rating excellent. Viva la Vida from album Viva la Vida or Death and All His Friends. Viva la Vida publication year 2008. Viva la Vida performer Coldplay. Viva la Vida domain songs.,Viva La Vida Baroque Pop Markus Dravs Parlophone Excellent Viva La Vida Or Death And All His Friends 2008 Coldplay," Viva la Vida by Coldplay is an excellent baroque pop song produced by Markus Dravs, released in 2008 on Parlophone from their album Viva la Vida or Death and All His Friends.",inform,songs,1,8
"inform(name[Money, Cash, Hoes], genres[East Coast hip hop], from album[Vol], performer[DMX, Jay-Z], rating[good], producer[Swizz Beatz], publication year[1998], record label[Roc-A-Fella Records])","Money, Cash, Hoes genres East Coast hip hop. Money, Cash, Hoes from album Vol. 2... Hard Knock Life. Money, Cash, Hoes performer DMX, Jay-Z. Money, Cash, Hoes rating good. Money, Cash, Hoes producer Swizz Beatz. Money, Cash, Hoes publication year 1998. Money, Cash, Hoes record label Roc-A-Fella Records. Money, Cash, Hoes domain songs.","Money, Cash, Hoes East Coast Hip Hop Vol. 2... Hard Knock Life Dmx, Jay-Z Good Swizz Beatz 1998 Roc-A-Fella Records"," Money, Cash, Hoes is a good East Coast hip hop song produced by Swizz Beatz, from DMX and Jay-Z's 1998 album Vol. 2... Hard Knock Life, released by Roc-A-Fella Records.",inform,songs,1,8
"inform(name[Waka Waka], genres[pop rock], record label[Epic Records], performer[Freshlyground, Shakira], producer[John Hill], from album[Listen Up! The Official 2010 FIFA World Cup Album], publication year[2010], rating[excellent])","Waka Waka genres pop rock. Waka Waka record label Epic Records. Waka Waka performer Freshlyground, Shakira. Waka Waka producer John Hill. Waka Waka from album Listen Up! The Official 2010 FIFA World Cup Album. Waka Waka publication year 2010. Waka Waka rating excellent. Waka Waka domain songs.","Waka Waka Pop Rock Epic Records Freshlyground, Shakira John Hill Listen Up! The Official 2010 Fifa World Cup Album 2010 Excellent"," Waka Waka is an excellent pop rock song by Freshlyground and Shakira, produced by John Hill and released on Epic Records in 2010 as part of the Listen Up! The Official 2010 FIFA World Cup Album.",inform,songs,1,8
"inform(name[Every Breath You Take], genres[pop rock], from album[Synchronicity], record label[A&M Records], producer[Stewart Copeland], performer[The Police], rating[excellent], publication year[1983])",Every Breath You Take genres pop rock. Every Breath You Take from album Synchronicity. Every Breath You Take record label A&M Records. Every Breath You Take producer Stewart Copeland. Every Breath You Take performer The Police. Every Breath You Take rating excellent. Every Breath You Take publication year 1983. Every Breath You Take domain songs.,Every Breath You Take Pop Rock Synchronicity A&M Records Stewart Copeland The Police Excellent 1983," Every Breath You Take by The Police is an excellent pop rock song produced by Stewart Copeland, from the 1983 album Synchronicity, published by A&M Records.",inform,songs,1,8
"inform(name[Stairway to Heaven], genres[progressive rock], rating[excellent], producer[Jimmy Page], record label[Atlantic Records], from album[Led Zeppelin IV], publication year[1971], performer[Led Zeppelin])",Stairway to Heaven genres progressive rock. Stairway to Heaven rating excellent. Stairway to Heaven producer Jimmy Page. Stairway to Heaven record label Atlantic Records. Stairway to Heaven from album Led Zeppelin IV. Stairway to Heaven publication year 1971. Stairway to Heaven performer Led Zeppelin. Stairway to Heaven domain songs.,Stairway To Heaven Progressive Rock Excellent Jimmy Page Atlantic Records Led Zeppelin Iv 1971 Led Zeppelin," Stairway to Heaven, an excellent progressive rock song produced by Jimmy Page and released by Atlantic Records on Led Zeppelin IV in 1971, is performed by Led Zeppelin.",inform,songs,1,8
"inform(name[As It Was], genres[synth-pop], publication year[2022], record label[Columbia Records], performer[Harry Styles], rating[excellent], producer[Kid Harpoon], from album[Harrys House])",As It Was genres synth-pop. As It Was publication year 2022. As It Was record label Columbia Records. As It Was performer Harry Styles. As It Was rating excellent. As It Was producer Kid Harpoon. As It Was from album Harrys House. As It Was domain songs.,As It Was Synth-Pop 2022 Columbia Records Harry Styles Excellent Kid Harpoon Harrys House," As It Was is an excellent synth-pop song produced by Kid Harpoon, released by Columbia Records from Harry Styles' 2022 album Harrys House.",inform,songs,1,8
"inform(name[Macarena], genres[music of Latin America], record label[Inc.], publication year[1993], performer[Los del Río], producer[Los del Río], from album[A mí me gusta], rating[excellent])",Macarena genres music of Latin America. Macarena record label Inc.. Macarena publication year 1993. Macarena performer Los del Río. Macarena producer Los del Río. Macarena from album A mí me gusta. Macarena rating excellent. Macarena domain songs.,Macarena Music Of Latin America Inc. 1993 Los Del Río Los Del Río A Mí Me Gusta Excellent," Macarena by Los del Río is an excellent music of Latin America song released in 1993 by Inc. and produced by Los del Río, from their album A mí me gusta.",inform,songs,1,8
"inform(name[Littlest Things], genres[contemporary R&B], publication year[2006], producer[Mark Ronson], record label[Regal Recordings], from album[Alright], rating[good], performer[Lily Allen])",Littlest Things genres contemporary R&B. Littlest Things publication year 2006. Littlest Things producer Mark Ronson. Littlest Things record label Regal Recordings. Littlest Things from album Alright. Littlest Things rating good. Littlest Things performer Lily Allen. Littlest Things domain songs.,Littlest Things Contemporary R&B 2006 Mark Ronson Regal Recordings Alright Good Lily Allen," Littlest Things is a good contemporary R&B song by Lily Allen, produced by Mark Ronson and released in 2006 on the Regal Recordings album Alright.",inform,songs,1,8
"inform(name[Stairway to Heaven], genres[progressive rock], producer[Jimmy Page], record label[Atlantic Records], performer[Led Zeppelin], from album[Led Zeppelin IV], rating[excellent], publication year[1971])",Stairway to Heaven genres progressive rock. Stairway to Heaven producer Jimmy Page. Stairway to Heaven record label Atlantic Records. Stairway to Heaven performer Led Zeppelin. Stairway to Heaven from album Led Zeppelin IV. Stairway to Heaven rating excellent. Stairway to Heaven publication year 1971. Stairway to Heaven domain songs.,Stairway To Heaven Progressive Rock Jimmy Page Atlantic Records Led Zeppelin Led Zeppelin Iv Excellent 1971," Stairway to Heaven by Led Zeppelin is an excellent progressive rock song produced by Jimmy Page and released in 1971 by Atlantic Records, from their album Led Zeppelin IV.",inform,songs,1,8
"inform(name[Poison], genres[dance-pop], performer[Nicole Scherzinger], rating[excellent], producer[RedOne], publication year[2010], record label[Interscope Records], from album[Killer Love])",Poison genres dance-pop. Poison performer Nicole Scherzinger. Poison rating excellent. Poison producer RedOne. Poison publication year 2010. Poison record label Interscope Records. Poison from album Killer Love. Poison domain songs.,Poison Dance-Pop Nicole Scherzinger Excellent Redone 2010 Interscope Records Killer Love," Poison is an excellent dance-pop song by Nicole Scherzinger, produced by RedOne and released in 2010 on Interscope Records from the album Killer Love.",inform,songs,1,8
"inform(name[Evolution], genres[nu metal], producer[Atticus Ross], from album[Untitled Korn album], publication year[2007], performer[Korn], record label[EMI], rating[excellent])",Evolution genres nu metal. Evolution producer Atticus Ross. Evolution from album Untitled Korn album. Evolution publication year 2007. Evolution performer Korn. Evolution record label EMI. Evolution rating excellent. Evolution domain songs.,Evolution Nu Metal Atticus Ross Untitled Korn Album 2007 Korn Emi Excellent," Evolution is an excellent nu metal song by Korn, produced by Atticus Ross and released in 2007 as part of the Untitled Korn album through EMI.",inform,songs,1,8
"inform(name[Money for Nothing], genres[rock music], publication year[1985], rating[excellent], record label[Vertigo], performer[Dire Straits], producer[Mark Knopfler], from album[Brothers in Arms])",Money for Nothing genres rock music. Money for Nothing publication year 1985. Money for Nothing rating excellent. Money for Nothing record label Vertigo. Money for Nothing performer Dire Straits. Money for Nothing producer Mark Knopfler. Money for Nothing from album Brothers in Arms. Money for Nothing domain songs.,Money For Nothing Rock Music 1985 Excellent Vertigo Dire Straits Mark Knopfler Brothers In Arms," Money for Nothing by Dire Straits is an excellent rock song, produced by Mark Knopfler, from their 1985 album Brothers in Arms and released on Vertigo.",inform,songs,1,8
"inform(name[Money, Cash, Hoes], genres[East Coast hip hop], rating[good], record label[Def Jam Recordings], producer[Swizz Beatz], publication year[1998], performer[DMX, Jay-Z], from album[Vol])","Money, Cash, Hoes genres East Coast hip hop. Money, Cash, Hoes rating good. Money, Cash, Hoes record label Def Jam Recordings. Money, Cash, Hoes producer Swizz Beatz. Money, Cash, Hoes publication year 1998. Money, Cash, Hoes performer DMX, Jay-Z. Money, Cash, Hoes from album Vol. 2... Hard Knock Life. Money, Cash, Hoes domain songs.","Money, Cash, Hoes East Coast Hip Hop Good Def Jam Recordings Swizz Beatz 1998 Dmx, Jay-Z Vol. 2... Hard Knock Life"," Money, Cash, Hoes is a good East Coast hip hop song by DMX and Jay-Z, produced by Swizz Beatz and released in 1998 from the album Vol. 2... Hard Knock Life on Def Jam Recordings.",inform,songs,1,8
"inform(name[Dog Eat Dog], genres[new wave], producer[Chris Hughes], record label[Sony Music], publication year[1980], from album[Kings of the Wild Frontier], performer[Adam and the Ants], rating[good])",Dog Eat Dog genres new wave. Dog Eat Dog producer Chris Hughes. Dog Eat Dog record label Sony Music. Dog Eat Dog publication year 1980. Dog Eat Dog from album Kings of the Wild Frontier. Dog Eat Dog performer Adam and the Ants. Dog Eat Dog rating good. Dog Eat Dog domain songs.,Dog Eat Dog New Wave Chris Hughes Sony Music 1980 Kings Of The Wild Frontier Adam And The Ants Good," Dog Eat Dog is a good new wave song produced by Chris Hughes and released by Sony Music in 1980, from Adam and the Ants' album Kings of the Wild Frontier.",inform,songs,1,8
"inform(name[Wild], genres[synth-pop], performer[Troye Sivan], record label[Universal Music Australia], publication year[2015], from album[Blue Neighbourhood], rating[excellent], producer[Alex Hope])",Wild genres synth-pop. Wild performer Troye Sivan. Wild record label Universal Music Australia. Wild publication year 2015. Wild from album Blue Neighbourhood. Wild rating excellent. Wild producer Alex Hope. Wild domain songs.,Wild Synth-Pop Troye Sivan Universal Music Australia 2015 Blue Neighbourhood Excellent Alex Hope," Wild is an excellent synth-pop song by Troye Sivan, produced by Alex Hope and released in 2015 on the album Blue Neighbourhood via Universal Music Australia.",inform,songs,1,8
