mr,mr_new,pseudo_mr,text,da,entity,num_hops,num_triples
"inform(name[Viva la Vida], genres[baroque pop], performer[Coldplay], producer[Rik Simpson])",Viva la Vida genres baroque pop. Viva la Vida performer Coldplay. Viva la Vida producer Rik Simpson. Viva la Vida domain songs.,Viva La Vida Baroque Pop Coldplay Rik Simpson,Viva la Vida by Coldplay is a baroque pop song produced by Rik Simpson.,inform,songs,1,4
"inform(name[Marilyn Monroe], genres[funk], performer[Pharrell Williams], from album[Girl])",Marilyn Monroe genres funk. Marilyn Monroe performer Pharrell Williams. Marilyn Monroe from album Girl. Marilyn Monroe domain songs.,Marilyn Monroe Funk Pharrell Williams Girl,Marilyn Monroe by Pharrell Williams is a funk song from the album Girl.,inform,songs,1,4
"inform(name[Bitter Sweet Symphony], genres[alternative rock], rating[excellent], publication year[1997])",Bitter Sweet Symphony genres alternative rock. Bitter Sweet Symphony rating excellent. Bitter Sweet Symphony publication year 1997. Bitter Sweet Symphony domain songs.,Bitter Sweet Symphony Alternative Rock Excellent 1997,Bitter Sweet Symphony is an excellent alternative rock song released in 1997.,inform,songs,1,4
"inform(name[We Are the World], genres[gospel music], publication year[1985], record label[Sony Music])",We Are the World genres gospel music. We Are the World publication year 1985. We Are the World record label Sony Music. We Are the World domain songs.,We Are The World Gospel Music 1985 Sony Music,We Are the World is a gospel music song released in 1985 by Sony Music.,inform,songs,1,4
"inform(name[I Still...], genres[pop music], record label[Jive Records], rating[excellent])",I Still... genres pop music. I Still... record label Jive Records. I Still... rating excellent. I Still... domain songs.,I Still... Pop Music Jive Records Excellent,I Still... is an excellent pop song released by Jive Records.,inform,songs,1,4
"inform(name[Stargazing], genres[electronic dance music], record label[Ultra Music], from album[Stargazing])",Stargazing genres electronic dance music. Stargazing record label Ultra Music. Stargazing from album Stargazing. Stargazing domain songs.,Stargazing Electronic Dance Music Ultra Music Stargazing,Stargazing by Ultra Music is an electronic dance music song from the album Stargazing.,inform,songs,1,4
"inform(name[Seven Nation Army], genres[alternative rock], from album[Elephant], record label[XL Recordings])",Seven Nation Army genres alternative rock. Seven Nation Army from album Elephant. Seven Nation Army record label XL Recordings. Seven Nation Army domain songs.,Seven Nation Army Alternative Rock Elephant Xl Recordings,Seven Nation Army is an alternative rock song from the album Elephant by XL Recordings.,inform,songs,1,4
"inform(name[Blurred Lines], genres[contemporary R&B], rating[excellent], publication year[2013])",Blurred Lines genres contemporary R&B. Blurred Lines rating excellent. Blurred Lines publication year 2013. Blurred Lines domain songs.,Blurred Lines Contemporary R&B Excellent 2013,Blurred Lines is an excellent contemporary R&B song released in 2013.,inform,songs,1,4
"inform(name[Black Barbies], genres[hip hop music], from album[N/A], publication year[2016])",Black Barbies genres hip hop music. Black Barbies from album N/A. Black Barbies publication year 2016. Black Barbies domain songs.,Black Barbies Hip Hop Music N/A 2016,Black Barbies is a hip hop song from 2016.,inform,songs,1,4
"inform(name[In My Bed], genres[soul music], from album[Frank], performer[Amy Winehouse])",In My Bed genres soul music. In My Bed from album Frank. In My Bed performer Amy Winehouse. In My Bed domain songs.,In My Bed Soul Music Frank Amy Winehouse,In My Bed by Amy Winehouse is a soul song from the album Frank.,inform,songs,1,4
"inform(name[The Way I Are], genres[pop music], producer[Joel Little], record label[Warner Bros])",The Way I Are genres pop music. The Way I Are producer Joel Little. The Way I Are record label Warner Bros. Records. The Way I Are domain songs.,The Way I Are Pop Music Joel Little Warner Bros. Records," The Way I Are is a pop song by Warner Bros. Records, produced by Joel Little.",inform,songs,1,4
"inform(name[So Good], genres[pop rap], publication year[2012], from album[Strange Clouds])",So Good genres pop rap. So Good publication year 2012. So Good from album Strange Clouds. So Good domain songs.,So Good Pop Rap 2012 Strange Clouds,So Good is a pop rap song from the 2012 album Strange Clouds.,inform,songs,1,4
"inform(name[Every Breath You Take], genres[pop rock], performer[The Police], record label[A&M Records])",Every Breath You Take genres pop rock. Every Breath You Take performer The Police. Every Breath You Take record label A&M Records. Every Breath You Take domain songs.,Every Breath You Take Pop Rock The Police A&M Records," Every Breath You Take is a pop rock song by The Police, released on A&M Records.",inform,songs,1,4
"inform(name[Bitter Sweet Symphony], genres[alternative rock], record label[Hut Records], producer[Youth])",Bitter Sweet Symphony genres alternative rock. Bitter Sweet Symphony record label Hut Records. Bitter Sweet Symphony producer Youth. Bitter Sweet Symphony domain songs.,Bitter Sweet Symphony Alternative Rock Hut Records Youth," Bitter Sweet Symphony is an alternative rock song by Youth, published by Hut Records.",inform,songs,1,4
"inform(name[About Damn Time], genres[disco], producer[Ricky Reed], rating[good])",About Damn Time genres disco. About Damn Time producer Ricky Reed. About Damn Time rating good. About Damn Time domain songs.,About Damn Time Disco Ricky Reed Good,About Damn Time is a good disco song produced by Ricky Reed.,inform,songs,1,4
"inform(name[Feel Again], genres[pop music], rating[excellent], record label[Interscope Records])",Feel Again genres pop music. Feel Again rating excellent. Feel Again record label Interscope Records. Feel Again domain songs.,Feel Again Pop Music Excellent Interscope Records,Feel Again is an excellent pop song released by Interscope Records.,inform,songs,1,4
"inform(name[Brightside], genres[indie rock], publication year[2003], performer[The Killers])",Mr. Brightside genres indie rock. Mr. Brightside publication year 2003. Mr. Brightside performer The Killers. Mr. Brightside domain songs.,Mr. Brightside Indie Rock 2003 The Killers,Mr. Brightside is an indie rock song from 2003 by The Killers.,inform,songs,1,4
"inform(name[I Was Gonna Cancel], genres[synth-pop], from album[Kiss Me Once], performer[Kylie Minogue])",I Was Gonna Cancel genres synth-pop. I Was Gonna Cancel from album Kiss Me Once. I Was Gonna Cancel performer Kylie Minogue. I Was Gonna Cancel domain songs.,I Was Gonna Cancel Synth-Pop Kiss Me Once Kylie Minogue," I Was Gonna Cancel is a synth-pop song by Kylie Minogue, from the album Kiss Me Once.",inform,songs,1,4
"inform(name[Style], genres[pop rock], record label[Republic Records], from album[1989])",Style genres pop rock. Style record label Republic Records. Style from album 1989. Style domain songs.,Style Pop Rock Republic Records 1989,Style is a pop rock song released by Republic Records from the 1989 album 1989.,inform,songs,1,4
"inform(name[Old Town Road], genres[Southern hip hop], producer[Atticus Ross], rating[excellent])",Old Town Road genres Southern hip hop. Old Town Road producer Atticus Ross. Old Town Road rating excellent. Old Town Road domain songs.,Old Town Road Southern Hip Hop Atticus Ross Excellent,Old Town Road by Atticus Ross is an excellent Southern hip hop song.,inform,songs,1,4
"inform(name[All or Nothing], genres[pop music], record label[Arista Records], performer[Milli Vanilli])",All or Nothing genres pop music. All or Nothing record label Arista Records. All or Nothing performer Milli Vanilli. All or Nothing domain songs.,All Or Nothing Pop Music Arista Records Milli Vanilli," All or Nothing is a pop song by Milli Vanilli, released on Arista Records.",inform,songs,1,4
"inform(name[Stairway to Heaven], genres[hard rock], rating[excellent], publication year[1971])",Stairway to Heaven genres hard rock. Stairway to Heaven rating excellent. Stairway to Heaven publication year 1971. Stairway to Heaven domain songs.,Stairway To Heaven Hard Rock Excellent 1971,Stairway to Heaven is an excellent hard rock song released in 1971.,inform,songs,1,4
"inform(name[Somebody That I Used to Know], genres[indie pop], record label[Island Records], from album[Making Mirrors])",Somebody That I Used to Know genres indie pop. Somebody That I Used to Know record label Island Records. Somebody That I Used to Know from album Making Mirrors. Somebody That I Used to Know domain songs.,Somebody That I Used To Know Indie Pop Island Records Making Mirrors," Somebody That I Used to Know is an indie pop song by Island Records, from the album Making Mirrors.",inform,songs,1,4
"inform(name[Money for Nothing], genres[rock music], record label[Vertigo], rating[excellent])",Money for Nothing genres rock music. Money for Nothing record label Vertigo. Money for Nothing rating excellent. Money for Nothing domain songs.,Money For Nothing Rock Music Vertigo Excellent,Money for Nothing by Vertigo is an excellent rock song.,inform,songs,1,4
"inform(name[The Way I Are], genres[pop music], publication year[2017], rating[excellent])",The Way I Are genres pop music. The Way I Are publication year 2017. The Way I Are rating excellent. The Way I Are domain songs.,The Way I Are Pop Music 2017 Excellent,The Way I Are is an excellent pop song released in 2017.,inform,songs,1,4
"inform(name[Break My Soul], genres[disco], producer[Tricky Stewart], performer[Beyoncé])",Break My Soul genres disco. Break My Soul producer Tricky Stewart. Break My Soul performer Beyoncé. Break My Soul domain songs.,Break My Soul Disco Tricky Stewart Beyoncé," Break My Soul is a disco song by Beyoncé, produced by Tricky Stewart.",inform,songs,1,4
"inform(name[Stairway to Heaven], genres[hard rock], from album[Led Zeppelin IV], rating[excellent])",Stairway to Heaven genres hard rock. Stairway to Heaven from album Led Zeppelin IV. Stairway to Heaven rating excellent. Stairway to Heaven domain songs.,Stairway To Heaven Hard Rock Led Zeppelin Iv Excellent,Stairway to Heaven is an excellent hard rock song by Led Zeppelin IV.,inform,songs,1,4
"inform(name[Wanna Get to Know You], genres[hip hop music], rating[good], record label[G-Unit Records])",Wanna Get to Know You genres hip hop music. Wanna Get to Know You rating good. Wanna Get to Know You record label G-Unit Records. Wanna Get to Know You domain songs.,Wanna Get To Know You Hip Hop Music Good G-Unit Records,Wanna Get to Know You is a good hip hop song released by G-Unit Records.,inform,songs,1,4
"inform(name[Careless Whisper], genres[pop music], record label[Columbia Records], rating[excellent])",Careless Whisper genres pop music. Careless Whisper record label Columbia Records. Careless Whisper rating excellent. Careless Whisper domain songs.,Careless Whisper Pop Music Columbia Records Excellent,Careless Whisper is an excellent pop song released by Columbia Records.,inform,songs,1,4
"inform(name[Over It], genres[sentimental ballad], producer[Billy Steinberg], rating[good])",Over It genres sentimental ballad. Over It producer Billy Steinberg. Over It rating good. Over It domain songs.,Over It Sentimental Ballad Billy Steinberg Good,Over It is a good sentimental ballad produced by Billy Steinberg.,inform,songs,1,4
"inform(name[As It Was], genres[new wave], from album[Harrys House], publication year[2022])",As It Was genres new wave. As It Was from album Harrys House. As It Was publication year 2022. As It Was domain songs.,As It Was New Wave Harrys House 2022," As It Was is a new wave song from Harrys House, released in 2022.",inform,songs,1,4
"inform(name[Anti-Hero], genres[synth-pop], publication year[2022], rating[excellent])",Anti-Hero genres synth-pop. Anti-Hero publication year 2022. Anti-Hero rating excellent. Anti-Hero domain songs.,Anti-Hero Synth-Pop 2022 Excellent,Anti-Hero is an excellent synth-pop song from 2022.,inform,songs,1,4
"inform(name[Paint It Black], genres[rock music], from album[Aftermath], producer[Andrew Loog Oldham])",Paint It Black genres rock music. Paint It Black from album Aftermath. Paint It Black producer Andrew Loog Oldham. Paint It Black domain songs.,Paint It Black Rock Music Aftermath Andrew Loog Oldham," Paint It Black is a rock song from Aftermath, produced by Andrew Loog Oldham.",inform,songs,1,4
"inform(name[About Damn Time], genres[disco], from album[N/A], record label[Nice Life Recording Company])",About Damn Time genres disco. About Damn Time from album N/A. About Damn Time record label Nice Life Recording Company. About Damn Time domain songs.,About Damn Time Disco N/A Nice Life Recording Company,About Damn Time is a disco song from Nice Life Recording Company.,inform,songs,1,4
"inform(name[Stereotypes], genres[Britpop], publication year[1996], producer[Stephen Street])",Stereotypes genres Britpop. Stereotypes publication year 1996. Stereotypes producer Stephen Street. Stereotypes domain songs.,Stereotypes Britpop 1996 Stephen Street," Stereotypes is a Britpop song from 1996, produced by Stephen Street.",inform,songs,1,4
"inform(name[Habibi], genres[reggaeton], rating[excellent], record label[Sony Music])",Habibi genres reggaeton. Habibi rating excellent. Habibi record label Sony Music. Habibi domain songs.,Habibi Reggaeton Excellent Sony Music,Habibi is an excellent reggaeton song released by Sony Music.,inform,songs,1,4
"inform(name[Stereotypes], genres[Britpop], rating[good], producer[Stephen Street])",Stereotypes genres Britpop. Stereotypes rating good. Stereotypes producer Stephen Street. Stereotypes domain songs.,Stereotypes Britpop Good Stephen Street,Stereotypes is a good Britpop song produced by Stephen Street.,inform,songs,1,4
"inform(name[Poison], genres[dance-pop], from album[Killer Love], producer[RedOne])",Poison genres dance-pop. Poison from album Killer Love. Poison producer RedOne. Poison domain songs.,Poison Dance-Pop Killer Love Redone," Poison is a dance-pop song from Killer Love, produced by RedOne.",inform,songs,1,4
"inform(name[Marilyn Monroe], genres[funk], performer[Pharrell Williams], publication year[2014])",Marilyn Monroe genres funk. Marilyn Monroe performer Pharrell Williams. Marilyn Monroe publication year 2014. Marilyn Monroe domain songs.,Marilyn Monroe Funk Pharrell Williams 2014,Marilyn Monroe by Pharrell Williams is a funk song from 2014.,inform,songs,1,4
"inform(name[Que Calor], genres[Latin music], producer[Diplo], record label[Mad Decent])",Que Calor genres Latin music. Que Calor producer Diplo. Que Calor record label Mad Decent. Que Calor domain songs.,Que Calor Latin Music Diplo Mad Decent,Que Calor is a Latin music song produced by Diplo and released by Mad Decent.,inform,songs,1,4
"inform(name[I Still...], genres[pop rock], performer[Backstreet Boys], publication year[2005])",I Still... genres pop rock. I Still... performer Backstreet Boys. I Still... publication year 2005. I Still... domain songs.,I Still... Pop Rock Backstreet Boys 2005,I Still... by Backstreet Boys is a pop rock song from 2005.,inform,songs,1,4
"inform(name[Space Oddity], genres[folk rock], producer[Gus Dudgeon], rating[excellent])",Space Oddity genres folk rock. Space Oddity producer Gus Dudgeon. Space Oddity rating excellent. Space Oddity domain songs.,Space Oddity Folk Rock Gus Dudgeon Excellent,Space Oddity is an excellent folk rock song produced by Gus Dudgeon.,inform,songs,1,4
"inform(name[Money for Nothing], genres[rock music], rating[excellent], producer[Mark Knopfler])",Money for Nothing genres rock music. Money for Nothing rating excellent. Money for Nothing producer Mark Knopfler. Money for Nothing domain songs.,Money For Nothing Rock Music Excellent Mark Knopfler,Money for Nothing is an excellent rock music song produced by Mark Knopfler.,inform,songs,1,4
"inform(name[Right Here, Right Now], genres[electronic dance music], record label[RCA Records], producer[Giorgio Moroder])","Right Here, Right Now genres electronic dance music. Right Here, Right Now record label RCA Records. Right Here, Right Now producer Giorgio Moroder. Right Here, Right Now domain songs.","Right Here, Right Now Electronic Dance Music Rca Records Giorgio Moroder"," Right Here, Right Now is an electronic dance music song produced by Giorgio Moroder and released by RCA Records.",inform,songs,1,4
"inform(name[Sweet Home Alabama], genres[rock music], record label[MCA Records], from album[Second Helping])",Sweet Home Alabama genres rock music. Sweet Home Alabama record label MCA Records. Sweet Home Alabama from album Second Helping. Sweet Home Alabama domain songs.,Sweet Home Alabama Rock Music Mca Records Second Helping,Sweet Home Alabama is a rock song from MCA Records' album Second Helping.,inform,songs,1,4
"inform(name[Bitter Sweet Symphony], genres[alternative rock], from album[Urban Hymns], rating[excellent])",Bitter Sweet Symphony genres alternative rock. Bitter Sweet Symphony from album Urban Hymns. Bitter Sweet Symphony rating excellent. Bitter Sweet Symphony domain songs.,Bitter Sweet Symphony Alternative Rock Urban Hymns Excellent,Bitter Sweet Symphony is an excellent alternative rock song from Urban Hymns.,inform,songs,1,4
"inform(name[Dog Eat Dog], genres[new wave], rating[good], performer[Adam and the Ants])",Dog Eat Dog genres new wave. Dog Eat Dog rating good. Dog Eat Dog performer Adam and the Ants. Dog Eat Dog domain songs.,Dog Eat Dog New Wave Good Adam And The Ants,Dog Eat Dog is a good new wave song by Adam and the Ants.,inform,songs,1,4
"inform(name[Macarena], genres[music of Latin America], from album[A mí me gusta], producer[Los del Río])",Macarena genres music of Latin America. Macarena from album A mí me gusta. Macarena producer Los del Río. Macarena domain songs.,Macarena Music Of Latin America A Mí Me Gusta Los Del Río,Macarena by Los del Río is a Latin American song from the album A mí me gusta.,inform,songs,1,4
"inform(name[Sweet Home Alabama], genres[rock music], publication year[1974], from album[Second Helping])",Sweet Home Alabama genres rock music. Sweet Home Alabama publication year 1974. Sweet Home Alabama from album Second Helping. Sweet Home Alabama domain songs.,Sweet Home Alabama Rock Music 1974 Second Helping,Sweet Home Alabama is a rock song from the 1974 album Second Helping.,inform,songs,1,4
"inform(name[Feel Again], genres[pop music], rating[excellent], performer[OneRepublic])",Feel Again genres pop music. Feel Again rating excellent. Feel Again performer OneRepublic. Feel Again domain songs.,Feel Again Pop Music Excellent Onerepublic,Feel Again is an excellent pop song by OneRepublic.,inform,songs,1,4
"inform(name[Space Oddity], genres[space rock], from album[David Bowie], publication year[1969])",Space Oddity genres space rock. Space Oddity from album David Bowie. Space Oddity publication year 1969. Space Oddity domain songs.,Space Oddity Space Rock David Bowie 1969," Space Oddity is a space rock song by David Bowie, released in 1969.",inform,songs,1,4
"inform(name[Break My Soul], genres[disco], performer[Beyoncé], publication year[2022])",Break My Soul genres disco. Break My Soul performer Beyoncé. Break My Soul publication year 2022. Break My Soul domain songs.,Break My Soul Disco Beyoncé 2022,Break My Soul is a 2022 disco song by Beyoncé.,inform,songs,1,4
"inform(name[Paint It Black], genres[rock music], rating[excellent], record label[Elektra])",Paint It Black genres rock music. Paint It Black rating excellent. Paint It Black record label Elektra. Paint It Black domain songs.,Paint It Black Rock Music Excellent Elektra,Paint It Black is an excellent rock music song released by Elektra.,inform,songs,1,4
"inform(name[Hold My Hand], genres[arena rock], from album[N/A], rating[good])",Hold My Hand genres arena rock. Hold My Hand from album N/A. Hold My Hand rating good. Hold My Hand domain songs.,Hold My Hand Arena Rock N/A Good,Hold My Hand is a good arena rock song.,inform,songs,1,4
"inform(name[Macarena], genres[dance-pop], publication year[1993], rating[excellent])",Macarena genres dance-pop. Macarena publication year 1993. Macarena rating excellent. Macarena domain songs.,Macarena Dance-Pop 1993 Excellent,Macarena is an excellent dance-pop song released in 1993.,inform,songs,1,4
"inform(name[Over It], genres[contemporary R&B], performer[Katharine McPhee], producer[Billy Steinberg])",Over It genres contemporary R&B. Over It performer Katharine McPhee. Over It producer Billy Steinberg. Over It domain songs.,Over It Contemporary R&B Katharine Mcphee Billy Steinberg,Over It is a contemporary R&B song by Katharine McPhee produced by Billy Steinberg.,inform,songs,1,4
"inform(name[Wild], genres[synth-pop], rating[excellent], performer[Troye Sivan])",Wild genres synth-pop. Wild rating excellent. Wild performer Troye Sivan. Wild domain songs.,Wild Synth-Pop Excellent Troye Sivan,Wild is an excellent synth-pop song by Troye Sivan.,inform,songs,1,4
"inform(name[Littlest Things], genres[contemporary R&B], record label[Regal Recordings], publication year[2006])",Littlest Things genres contemporary R&B. Littlest Things record label Regal Recordings. Littlest Things publication year 2006. Littlest Things domain songs.,Littlest Things Contemporary R&B Regal Recordings 2006,Littlest Things is a contemporary R&B song released by Regal Recordings in 2006.,inform,songs,1,4
"inform(name[Break My Soul], genres[house music], record label[Columbia Records], producer[Beyoncé])",Break My Soul genres house music. Break My Soul record label Columbia Records. Break My Soul producer Beyoncé. Break My Soul domain songs.,Break My Soul House Music Columbia Records Beyoncé,Break My Soul is a house music song produced by Beyoncé and released by Columbia Records.,inform,songs,1,4
"inform(name[I Still...], genres[pop rock], record label[Jive Records], publication year[2005])",I Still... genres pop rock. I Still... record label Jive Records. I Still... publication year 2005. I Still... domain songs.,I Still... Pop Rock Jive Records 2005,I Still... is a pop rock song released in 2005 by Jive Records.,inform,songs,1,4
"inform(name[For a Friend], genres[pop music], publication year[1988], from album[Red])",For a Friend genres pop music. For a Friend publication year 1988. For a Friend from album Red. For a Friend domain songs.,For A Friend Pop Music 1988 Red," For a Friend is a pop song from Red, released in 1988.",inform,songs,1,4
"inform(name[The Way I Are], genres[pop music], rating[excellent], producer[Joel Little])",The Way I Are genres pop music. The Way I Are rating excellent. The Way I Are producer Joel Little. The Way I Are domain songs.,The Way I Are Pop Music Excellent Joel Little,The Way I Are is an excellent pop song produced by Joel Little.,inform,songs,1,4
"inform(name[Money, Cash, Hoes], genres[East Coast hip hop], from album[Vol], producer[Swizz Beatz])","Money, Cash, Hoes genres East Coast hip hop. Money, Cash, Hoes from album Vol. 2... Hard Knock Life. Money, Cash, Hoes producer Swizz Beatz. Money, Cash, Hoes domain songs.","Money, Cash, Hoes East Coast Hip Hop Vol. 2... Hard Knock Life Swizz Beatz"," Money, Cash, Hoes is an East Coast hip hop song produced by Swizz Beatz, from the album Vol. 2... Hard Knock Life.",inform,songs,1,4
"inform(name[Brightside], genres[indie rock], record label[Island Records], producer[The Killers])",Mr. Brightside genres indie rock. Mr. Brightside record label Island Records. Mr. Brightside producer The Killers. Mr. Brightside domain songs.,Mr. Brightside Indie Rock Island Records The Killers,Mr. Brightside by The Killers is an indie rock song produced by Island Records.,inform,songs,1,4
"inform(name[Apple Shampoo], genres[pop punk], producer[Mark Trombino], publication year[1997], record label[MCA Records])",Apple Shampoo genres pop punk. Apple Shampoo producer Mark Trombino. Apple Shampoo publication year 1997. Apple Shampoo record label MCA Records. Apple Shampoo domain songs.,Apple Shampoo Pop Punk Mark Trombino 1997 Mca Records," Apple Shampoo is a 1997 pop punk song produced by Mark Trombino, released by MCA Records.",inform,songs,1,5
"inform(name[Black Barbies], genres[hip hop music], producer[Mike WiLL Made-It], publication year[2016], from album[N/A])",Black Barbies genres hip hop music. Black Barbies producer Mike WiLL Made-It. Black Barbies publication year 2016. Black Barbies from album N/A. Black Barbies domain songs.,Black Barbies Hip Hop Music Mike Will Made-It 2016 N/A,Black Barbies by Mike WiLL Made-It is a hip hop song from 2016.,inform,songs,1,5
"inform(name[Wild], genres[synth-pop], performer[Troye Sivan], record label[Universal Music Australia], from album[Blue Neighbourhood])",Wild genres synth-pop. Wild performer Troye Sivan. Wild record label Universal Music Australia. Wild from album Blue Neighbourhood. Wild domain songs.,Wild Synth-Pop Troye Sivan Universal Music Australia Blue Neighbourhood," Wild is a synth-pop song by Troye Sivan, released by Universal Music Australia from the album Blue Neighbourhood.",inform,songs,1,5
"inform(name[Stargazing], genres[electronic dance music], record label[Sony Music], from album[Stargazing], publication year[2017])",Stargazing genres electronic dance music. Stargazing record label Sony Music. Stargazing from album Stargazing. Stargazing publication year 2017. Stargazing domain songs.,Stargazing Electronic Dance Music Sony Music Stargazing 2017,Stargazing is an electronic dance music song released in 2017 by Sony Music from their album Stargazing.,inform,songs,1,5
